дата,время,рейтинг,текст,автор,likes_count,official_answer,город,люди
2025-10-24,15:09:23,5,"Огромное спасибо, сотруднице банка Шакирова Гульфайруз , оказала большую мне помощь❤️",Жулдыз Серикболатовна,0,"{'date_created': '2025-10-24T16:01:56.465605+07:00', 'id': '55682257', 'logo_preview_urls': {}, 'org_name': 'Freedom Bank', 'text': 'Добрый день!\nСпасибо вам за тёплый отзыв! \nМы рады, что смогли помочь и вы остались довольны обслуживанием. \nБлагодарим за доверие к Freedom Bank! 💚'}",Талдыкорган,гульфайруз шакирова
2025-10-23,23:22:10,5,"Я довольна обслуживанием, пришла с проблемой девушка помогла кажется Шекер зовут.. спасибо большое!",Мадина Смагулова,0,"{'date_created': '2025-10-24T11:03:32.591859+07:00', 'id': '55664147', 'logo_preview_urls': {}, 'org_name': 'Freedom Bank', 'text': 'Доброе утро!\nСпасибо вам за тёплый отзыв! \nМы рады, что смогли помочь и вы остались довольны обслуживанием. \nБлагодарим за доверие к Freedom Bank Kazakhstan! 💚'}",Талдыкорган,кулахметова шекер
2025-10-21,16:42:28,5,"Хороший банк и условия классные 
Коллектив приветливый 
Супервайзер Акбота вообще молодец знает свою работу 
Грамотно проконсультировала и проводила до менеджера",Нуржан Оспанов,0,"{'date_created': '2025-10-22T06:46:15.573018+07:00', 'id': '55534924', 'logo_preview_urls': {}, 'org_name': 'Freedom Bank', 'text': 'Доброе утро! Благодарим вас за положительный отзыв. Мы рады, что вы остались довольны нашим сервисом.'}",Талдыкорган,
2025-10-21,12:04:41,5,"Благодарен сектору ЮЛ менеджер Нуржан хороший специалист, мастер своего дела🔥🔥🔥",Rafa,0,"{'date_created': '2025-10-22T06:33:34.169742+07:00', 'id': '55534716', 'logo_preview_urls': {}, 'org_name': 'Freedom Bank', 'text': 'Доброе утро! Благодарим вас за положительный отзыв. Нам очень приятно, что вы отметили профессионализм и работу нашего менеджера.'}",Талдыкорган,
2025-10-21,11:22:50,5,Отличный банк. Менеджер Юлия лучшая из лучших. Очень отзывчивая и добрая девушка.,Юлия Дусаева,0,"{'date_created': '2025-10-22T06:32:14.876298+07:00', 'id': '55534701', 'logo_preview_urls': {}, 'org_name': 'Freedom Bank', 'text': 'Доброе утро! Благодарим вас за положительный отзыв. Нам очень приятно, что вы отметили отзывчивость и высокий уровень нашего сервиса.'}",Талдыкорган,
2025-10-21,00:40:16,5,"Хороший банк, отличный сервис",Tima .,0,"{'date_created': '2025-10-22T06:31:33.513938+07:00', 'id': '55534691', 'logo_preview_urls': {}, 'org_name': 'Freedom Bank', 'text': 'Доброе утро! Благодарим вас за положительный отзыв!'}",Талдыкорган,
2025-10-21,00:37:18,5,Өте жаксы банк. Қызметкерлері де өте сыпайы және өз істерінің мамандары әсіресе Оразай Айым Ержанқызына рақмет!!,Alibek Slamzhan,0,"{'date_created': '2025-10-22T06:29:55.031554+07:00', 'id': '55534657', 'logo_preview_urls': {}, 'org_name': 'Freedom Bank', 'text': 'Қайырлы таң! Өз пікіріңізбен бөліскеніңізге рақмет! Біздің банкке берген жоғары бағаңыз бен қызметкерлердің сыпайылығы және кәсіби біліктілігін атап өткеніңіз біз үшін маңызды.'}",Талдыкорган,
2025-10-21,00:34:28,5,"Посетила отделение банка, осталась довольна обслуживанием.
Хочу поблагодарить менеджера Оразай Айым Ержанкызы за профессионализм, вежливость и доброжелательное отношение.
Работа сотрудников на высоком уровне!",Жангуль Смагулова,0,"{'date_created': '2025-10-22T06:29:38.720029+07:00', 'id': '55534647', 'logo_preview_urls': {}, 'org_name': 'Freedom Bank', 'text': 'Доброе утро! Благодарим вас за положительный отзыв. Нам очень приятно, что вы остались довольны обслуживанием и отметили качество нашего сервиса.'}",Талдыкорган,айым ержанқызы
2025-10-21,00:27:45,5,"Огромное спасибо Айман за консультацию, вы помогли открыть детскую карту и подвязать с Білім классом. Всё прошло супер!",Инжу Жасулан,0,"{'date_created': '2025-10-22T06:29:13.202807+07:00', 'id': '55534637', 'logo_preview_urls': {}, 'org_name': 'Freedom Bank', 'text': 'Доброе утро! Мы рады, что ваш вопрос был успешно решен. Благодарим вас за отзыв.'}",Талдыкорган,айман кеткенова
2025-10-20,21:14:47,5,"Спасибо за консультацию про сейфовые ячейку, очень коммуникабельные менеджера. Процветания банку. Каткеновой Айман огромная благодарность за отзывчивость.",Румия Рафаиловна Ногина Саринова,0,"{'date_created': '2025-10-22T06:26:17.501122+07:00', 'id': '55534612', 'logo_preview_urls': {}, 'org_name': 'Freedom Bank', 'text': 'Доброе утро! Благодарим вас за положительный отзыв. Нам важно, что вы получили качественную консультацию и отметили коммуникабельность наших менеджеров.'}",Талдыкорган,айман кеткенова
2025-10-20,21:14:41,5,"Спасибо,Кулахметова Шекер!
Сервис на высшем уровне !",Али Токтасын,0,"{'date_created': '2025-10-22T06:24:19.691242+07:00', 'id': '55534596', 'logo_preview_urls': {}, 'org_name': 'Freedom Bank', 'text': 'Доброе утро! Мы очень рады, что ваш опыт взаимодействия с банком оказался таким положительным. Нам важно, что вы оценили сервис на высшем уровне.'}",Талдыкорган,кулахметова шекер
2025-10-20,21:12:02,5,"Кулахметова Шекер молодец.
Приятный грамотный сотрудник.
Процветания и всего хорошего",Rus Rus,0,"{'date_created': '2025-10-22T06:24:06.181263+07:00', 'id': '55534592', 'logo_preview_urls': {}, 'org_name': 'Freedom Bank', 'text': 'Доброе утро! Спасибо, что уделили время для отзыва. Мы рады, что вы оценили грамотность и приятное общение с сотрудником.'}",Талдыкорган,кулахметова шекер
2025-10-20,21:09:13,5,"Кулахметова Шекер 
Приятный грамотный сотрудник
Процветания банку
По больше таких специалистов",Олжас Ногайбаев,0,"{'date_created': '2025-10-22T06:23:21.355199+07:00', 'id': '55534587', 'logo_preview_urls': {}, 'org_name': 'Freedom Bank', 'text': 'Доброе утро! Мы очень рады, что ваш опыт взаимодействия с банком оказался таким положительным. Нам приятно, что вы отметили грамотность нашего сервиса.'}",Талдыкорган,кулахметова шекер
2025-10-20,21:04:51,5,"Кулахметова Шекер
Специалист 👍 быстро качественно",Амир Токтасын,0,"{'date_created': '2025-10-22T06:26:52.37877+07:00', 'id': '55534617', 'logo_preview_urls': {}, 'org_name': 'Freedom Bank', 'text': 'Доброе утро! Благодарим вас за положительный отзыв. Нам важно, что вы оценили скорость и качество нашего обслуживания.'}",Талдыкорган,кулахметова шекер
2025-10-20,12:17:57,5,Кулахметова шекер отличный менеджер рахмет,Талгат Борамбаев,0,"{'date_created': '2025-10-20T18:39:27.077364+07:00', 'id': '55443176', 'logo_preview_urls': {}, 'org_name': 'Freedom Bank', 'text': 'Спасибо за вашу высокую оценку! Шекер — действительно профессионал своего дела, и мы рады, что вы это отметили. Приятно знать, что вы довольны сервисом!'}",Талдыкорган,кулахметова шекер
2025-10-18,14:41:52,5,"Отличный банк, комфортно, быстро всё, есть парковка",Алеся Угрюмова,0,"{'date_created': '2025-10-18T19:24:39.637174+07:00', 'id': '55348776', 'logo_preview_urls': {}, 'org_name': 'Freedom Bank', 'text': 'Добрый вечер! Спасибо вам большое за отзыв и высокую оценку🙌🏻 Всегда вам рады!'}",Талдыкорган,
2025-10-17,19:12:51,5,"Отличный банк. Менеджер Гульфайруз помогла мне разрешить мой вопрос, грамотный специалист и вежливое обслуживание.",Эрика Риппель,0,"{'date_created': '2025-10-17T19:57:45.726647+07:00', 'id': '55313737', 'logo_preview_urls': {}, 'org_name': 'Freedom Bank', 'text': 'Добрый вечер!\nСпасибо за ваш отзыв!💚\nРады, что менеджер Гульфайруз помогла вам быстро и профессионально.\nБлагодарим за доверие!💚'}",Талдыкорган,гульфайруз шакирова
2025-10-13,17:21:08,5,"Очень хорошее отделение банка, грамотные специалисты, хотелось бы выделить менеджера Шакирова Гульфайруз, все объяснила, помогла решить все вопросы, однозначно еще приду👍",Ринат Хамитов,0,"{'date_created': '2025-10-13T18:01:57.215308+07:00', 'id': '55059214', 'logo_preview_urls': {}, 'org_name': 'Freedom Bank', 'text': 'Добрый день! Спасибо за ваш отзыв. Рады, что отделение и наши специалисты помогли решить ваши вопросы и оставили положительное впечатление.'}",Талдыкорган,гульфайруз шакирова
2025-10-13,15:50:05,5,Отдельная благодарность Гульфайруз за профессионализм и доброжелательность!,N,0,"{'date_created': '2025-10-13T18:01:34.160852+07:00', 'id': '55059179', 'logo_preview_urls': {}, 'org_name': 'Freedom Bank', 'text': 'Добрый день! Спасибо за ваш отзыв. Рады, что наше обслуживание оставило положительное впечатление.'}",Талдыкорган,гульфайруз шакирова
2025-10-12,00:28:26,5,лучший банк кз,P X,0,"{'date_created': '2025-10-12T21:09:05.295904+07:00', 'id': '55001292', 'logo_preview_urls': {}, 'org_name': 'Freedom Bank', 'text': 'Добрый вечер! Спасибо вам за ваш отзыв и оценку! Мы всегда вам рады 😉'}",Талдыкорган,
2025-10-08,21:09:24,5,"Юлия очень доброжелательная сотрудница банка помогла мне установить приложение, открыть карту , спасибо огромное я осталась очень довольной",Gulya Bgd,0,"{'date_created': '2025-10-10T19:20:06.065811+07:00', 'id': '54926528', 'logo_preview_urls': {}, 'org_name': 'Freedom Bank', 'text': 'Добрый вечер! Спасибо за добрые слова! Рады, что смогли помочь! 😊'}",Талдыкорган,
2025-10-01,17:11:25,5,Отличный сотрудник Кулахметова Шекер,Ренат Габдракипов,1,"{'date_created': '2025-10-01T21:25:27.101372+07:00', 'id': '54433237', 'logo_preview_urls': {}, 'org_name': 'Freedom Bank', 'text': 'Здравствуйте, Ренат! Спасибо за отзыв и высокую оценку 🙏 Мы работаем для вас 😊💚'}",Талдыкорган,кулахметова шекер
2025-09-30,20:33:11,5,"Выражаю благодарность! 
Кулахметова Шекер",Мади С,0,"{'date_created': '2025-10-01T21:03:53.719043+07:00', 'id': '54432118', 'logo_preview_urls': {}, 'org_name': 'Freedom Bank', 'text': 'Добрый вечер! Большое спасибо за добрые слова о нашей работе 🙏 Всегда рады вам.'}",Талдыкорган,кулахметова шекер
2025-09-30,19:24:18,5,"Выражаю благодарность сотруднику банка Кулахметовой Шекер, очень грамотный специалист профессионал своего дела ✊",Бауржан Ерубаев,0,"{'date_created': '2025-10-01T20:55:25.622005+07:00', 'id': '54431712', 'logo_preview_urls': {}, 'org_name': 'Freedom Bank', 'text': 'Бауржан, здравствуйте, спасибо вам за такой приятный отзыв, рады работать для вас. 😊💚'}",Талдыкорган,кулахметова шекер
2025-09-30,16:04:32,5,Ваш сотрудник Кулахметова Шекер очень вежливо все подробно объясняет! Помогает по приложению 👍 процветания вашему банку у вас очень хорошие кешбеки👍👍👍 молодцы . Конкурентноспособный банк думаю! Процветания,Динара Магауянова,0,"{'date_created': '2025-10-01T20:47:30.426622+07:00', 'id': '54431362', 'logo_preview_urls': {}, 'org_name': 'Freedom Bank', 'text': 'Здравствуйте, Динара. Спасибо, очень приятно получать обратную связь 😉 Приходите ещё 😊💚'}",Талдыкорган,кулахметова шекер
2025-09-30,12:01:21,5,Кулахметова Шекер,Жанасыл Абдрасилов,0,"{'date_created': '2025-10-01T20:41:40.126952+07:00', 'id': '54431096', 'logo_preview_urls': {}, 'org_name': 'Freedom Bank', 'text': 'Добрый день! Благодарим за ваш отзыв! 💚'}",Талдыкорган,кулахметова шекер
2025-09-30,11:07:05,5,Кулахметова Шекер жаксы менеджер жұмысына ұқыпты өз ісінің шебері маған тез жасап берді,Daniyar Zhan,0,"{'date_created': '2025-10-01T20:40:58.213277+07:00', 'id': '54431060', 'logo_preview_urls': {}, 'org_name': 'Freedom Bank', 'text': 'Қайырлы кеш! Пікіріңізге үлкен алғысымызды білдіреміз! 😊💚'}",Талдыкорган,кулахметова шекер
2025-09-30,01:41:02,5,"Хочу выразить благодарность главному менеджеру Кулахметовой Шекер за высокий уровень профессионализма и внимательное отношение. Консультация была чёткой, понятной и максимально полезной. Все вопросы были решены быстро и без лишней волокиты. Очень приятно общаться с таким специалистом — видно, что человек на своём месте. Спасибо за качественное обслуживание!",Raushan Bukenbaeva,0,"{'date_created': '2025-10-01T20:38:58.205215+07:00', 'id': '54430977', 'logo_preview_urls': {}, 'org_name': 'Freedom Bank', 'text': 'Добрый вечер, спасибо, что выбираете нас 😊💚Нам очень приятно 🤝'}",Талдыкорган,кулахметова шекер
2025-09-30,01:02:33,5,Құлахметова Шекерге алғысым шексіз. Өз ісінің нағыз маманы екен.,Городская легенда,0,"{'date_created': '2025-10-01T20:38:10.127383+07:00', 'id': '54430949', 'logo_preview_urls': {}, 'org_name': 'Freedom Bank', 'text': 'Қайырлы кеш! Бізді таңдағаныңызға үлкен рақмет 😊💚'}",Талдыкорган,
2025-09-30,00:59:34,5,Кулахметова Шекер лучший менеджер 👍👍👍,Кайырбек Турсын,0,"{'date_created': '2025-10-01T20:37:05.374299+07:00', 'id': '54430892', 'logo_preview_urls': {}, 'org_name': 'Freedom Bank', 'text': 'Здравствуйте. Спасибо вам большое за отзыв и высокую оценку 😌'}",Талдыкорган,кулахметова шекер
2025-09-30,00:42:32,5,Кулахметова Шекер лучший менеджер 👍🏻,Карина Сергиенко,0,"{'date_created': '2025-10-01T20:36:14.411872+07:00', 'id': '54430849', 'logo_preview_urls': {}, 'org_name': 'Freedom Bank', 'text': 'Карина, здравствуйте. Большое спасибо за доверие 😊💚'}",Талдыкорган,кулахметова шекер
2025-09-30,00:36:34,5,"Хочу выразить благодарность менеджеру по работе с юридическими лицами Кулахметовой Шекер за высокий уровень профессионализма и внимательное отношение. Благодаря её консультациям все вопросы были решены быстро и четко, а необходимые документы подготовлены без задержек. Особенно ценю её готовность подробно объяснить нюансы и предложить удобные решения для бизнеса. Сотрудничество с таким специалистом делает работу с банком комфортной и надежной.",Рустам Омарбеков,0,"{'date_created': '2025-10-01T20:33:49.779046+07:00', 'id': '54430746', 'logo_preview_urls': {}, 'org_name': 'Freedom Bank', 'text': 'Рустам, добрый вечер! Спасибо вам, что уделили время и написали отзыв!!! Рады сотрудничеству. 😊💚'}",Талдыкорган,кулахметова шекер
2025-09-30,00:35:30,5,"Выражаю искреннюю благодарность Кулахметовой Шекер главному менеджеру по юридическим лицам за высокий профессионализм, внимательное отношение к клиентам и оперативное решение всех вопросов. Ваше ответственное отношение к работе заслуживает уважения и признательности.",Елнур Серик,0,"{'date_created': '2025-10-01T20:32:32.981371+07:00', 'id': '54430706', 'logo_preview_urls': {}, 'org_name': 'Freedom Bank', 'text': 'Добрый вечер, Елнур! Благодарим, очень приятно получать обратную связь 🤗 Будем стараться и дальше.'}",Талдыкорган,
2025-09-30,00:28:59,5,Өте керемет жоғарғы деңгейде қызмет көрсетті👍👍 Құлахметова Шекерге көп рахмет өз ісінің маманы,Корлан Алмасбеккызы,0,"{'date_created': '2025-10-01T20:30:23.630361+07:00', 'id': '54430605', 'logo_preview_urls': {}, 'org_name': 'Freedom Bank', 'text': 'Қайырлы кеш! Бізді таңдағаныңызға үлкен рақмет 😊💚'}",Талдыкорган,
2025-09-23,12:53:08,5,Очень хорошее обслуживание,Evgenia Li,0,"{'date_created': '2025-09-25T11:13:35.567521+07:00', 'id': '54081414', 'logo_preview_urls': {}, 'org_name': 'Freedom Bank', 'text': 'Доброе утро! Благодарим вас за отзыв. Нам очень приятно, что вы остались довольны качеством нашего обслуживания.'}",Талдыкорган,
2025-09-19,18:43:49,5,"самый новый крутой Банк, менеджера очень вежливые. Спасибо Анаре за полную,точную консультацию. Гульфайрус очень благодарен за помощь.",Самат Байгонаков,0,"{'date_created': '2025-09-21T19:51:03.029457+07:00', 'id': '53883815', 'logo_preview_urls': {}, 'org_name': 'Freedom Bank', 'text': 'Добрый вечер! Большое спасибо за ваш отзыв. Нам приятно слышать, что вы оценили работу наших менеджеров 🌟'}",Талдыкорган,
2025-09-16,13:31:40,5,Шекер отличный менеджер,Светлана,0,"{'date_created': '2025-09-16T15:21:35.531377+07:00', 'id': '53632828', 'logo_preview_urls': {}, 'org_name': 'Freedom Bank', 'text': 'Добрый день! Спасибо, нам важно ваше мнение!'}",Талдыкорган,
2025-09-14,23:06:13,5,"Спасибо за консультацию, очень грамотный персонал по физическим лицам, помогли все решить.",Ержан,0,"{'date_created': '2025-09-15T14:06:13.461283+07:00', 'id': '53559050', 'logo_preview_urls': {}, 'org_name': 'Freedom Bank', 'text': 'Благодарим за теплые слова 😌 Были рады помочь.'}",Талдыкорган,
2025-09-12,17:14:29,5,"Хочу выразить искреннюю благодарность Шакировой Гульфайруз, за высокий уровень профессионализма, внимательное отношение и оперативность в решении моего вопроса. Общение было максимально комфортным: все необходимые объяснения были даны в понятной форме, предложены выгодные условия, и процесс оформления прошёл быстро и без лишних сложностей.
Особенно хочется отметить вежливость, доброжелательность и готовность помочь в любой ситуации. Спасибо за качественный сервис и индивидуальный подход к клиенту.",Ulan Tokanov,0,"{'date_created': '2025-09-12T20:32:53.308947+07:00', 'id': '53449123', 'logo_preview_urls': {}, 'org_name': 'Freedom Bank', 'text': 'Добрый вечер! Благодарим вас за отзыв. Нам очень приятно, что обслуживание оставило у вас положительное впечатление, а процесс оформления прошёл быстро и удобно.'}",Талдыкорган,гульфайруз шакирова
2025-09-10,02:02:06,5,"Благодарю Сотрудника банка Шакирова Гульфайруз за профессионализм, компетентность и чуткое отношение к решению моей проблемы, связанной с некорректной работой интернет-банка с моим аккаунтом.",Мерей Бейсенбаев,0,"{'date_created': '2025-09-10T19:36:21.263892+07:00', 'id': '53319685', 'logo_preview_urls': {}, 'org_name': 'Freedom Bank', 'text': 'Мерей. Благодарим вас, очень приятно получать обратную связь 🔥 Были рады помочь 💛'}",Талдыкорган,гульфайруз шакирова
