дата,время,рейтинг,текст,автор,likes_count,official_answer,город,люди
2025-08-27,19:07:46,5,Спасибо Кулахметовой Шекер!,Aaa Bbb,0,"{'date_created': '2025-08-28T06:35:53.39774+07:00', 'id': '52557736', 'logo_preview_urls': {}, 'org_name': 'Freedom Bank', 'text': 'Доброе утро! Благодарим вас за отзыв. Нам очень приятно, что вы остались довольны работой нашего менеджера.'}",Талдыкорган,кулахметова шекер
2025-08-26,19:42:31,5,"Шекер Кулахметовнаға рақмет, тез тез бәрін түсіндіріп берді. Ризамыз",Maral Temirgali,1,"{'date_created': '2025-08-28T05:39:43.029964+07:00', 'id': '52557398', 'logo_preview_urls': {}, 'org_name': 'Freedom Bank', 'text': 'Қайырлы таң! Пікіріңіз үшін рақмет. Біздің менеджеріміздің жылдам көмегіне және түсіндірмелерінің анықтығына риза болғаныңызға қуаныштымыз.'}",Талдыкорган,
2025-08-26,19:39:01,5,"Кулахметова Шекер такая молодец❤️ клиенттермен түсіндіру жұмыстарын жоғары деңгейде жүргізе алады, қарым -қатынас мәденметі жоғары",Манар Темиргалиева,0,"{'date_created': '2025-08-28T05:39:01.370629+07:00', 'id': '52557393', 'logo_preview_urls': {}, 'org_name': 'Freedom Bank', 'text': 'Қайырлы таң! Пікіріңіз үшін үлкен рахмет. Біздің менеджеріміздің клиенттермен түсіндіру жұмыстарын жоғары деңгейде жүргізетінін және қарым-қатынас мәдениетінің жоғары екенін атап өткеніңізге қуаныштымыз.'}",Талдыкорган,кулахметова шекер
2025-08-26,19:00:25,5,"Отличный банк,менеджер Кулахметова Шекер высококлассный сотрудник",Ariphan Bukenbaev,1,"{'date_created': '2025-08-28T05:38:31.799551+07:00', 'id': '52557390', 'logo_preview_urls': {}, 'org_name': 'Freedom Bank', 'text': 'Доброе утро! Благодарим вас за отзыв и высокую оценку. Нам очень приятно, что вы отметили нашего менеджера как высококлассного сотрудника.'}",Талдыкорган,кулахметова шекер
2025-08-26,18:53:52,5,"Спасибо девушке Кулахмет Шекер, профессионал своего дела, остался очень рад👍",Azamat Beketbayev,1,"{'date_created': '2025-08-28T05:38:01.085305+07:00', 'id': '52557385', 'logo_preview_urls': {}, 'org_name': 'Freedom Bank', 'text': 'Доброе утро! Благодарим вас за отзыв. Нам очень приятно, что вы остались довольны профессионализмом нашего менеджера и ее помощью.'}",Талдыкорган,кулахметова шекер
2025-08-26,18:46:46,5,Отличное обслуживание Кулахмет Шекер,Админ Мегатау,1,"{'date_created': '2025-08-28T05:37:35.975335+07:00', 'id': '52557378', 'logo_preview_urls': {}, 'org_name': 'Freedom Bank', 'text': 'Доброе утро! Спасибо за ваш отзыв. Нам очень приятно, что вы высоко оценили качество обслуживания нашего менеджера.'}",Талдыкорган,кулахметова шекер
2025-08-26,17:22:41,5,"Хочу выразить благодарность менеджеру банка Кулахмет Шекер! За грамотность, за отзывчивость, за простое доброе отношение к клиентам. Карьерного роста вам Шекер!!!",Багжан Сатыбалдина,1,"{'date_created': '2025-08-28T05:36:48.544904+07:00', 'id': '52557368', 'logo_preview_urls': {}, 'org_name': 'Freedom Bank', 'text': 'Доброе утро! Благодарим вас за то, что уделили время, чтобы поделиться своим мнением. Нам очень приятно, что вы так высоко оценили профессионализм, отзывчивость и доброе отношение нашего менеджера к клиентам.'}",Талдыкорган,кулахметова шекер
2025-08-26,16:58:14,5,"Фридом банктегі Кулахметова Шекер ханымга рахмет, өз ісінің маманы. Барлық сұрақтарды банк қызметіне байланысты түсіндіріп, шешіп береді. Рахмет Шекер!!! Жұмыска табыс тілеймін!",Arailym Suleimenova,1,"{'date_created': '2025-08-28T05:35:47.206008+07:00', 'id': '52557358', 'logo_preview_urls': {}, 'org_name': 'Freedom Bank', 'text': 'Қайырлы таң! Пікіріңіз үшін үлкен рахмет. Біздің менеджеріміздің өз ісінің кәсіби маманы екенін және барлық сұрақтарыңызды шешуге көмектескенін атап өткеніңізге қуаныштымыз.'}",Талдыкорган,кулахметова шекер
2025-08-26,16:00:55,5,Кулахметова Шекер өте білікті маман! Рақмет👍,Aidos Zhumayev,1,"{'date_created': '2025-08-28T05:33:57.288938+07:00', 'id': '52557338', 'logo_preview_urls': {}, 'org_name': 'Freedom Bank', 'text': 'Қайырлы таң! Пікіріңіз үшін рахмет. Біздің менеджеріміздің біліктілігін жоғары бағалағаныңызға өте қуаныштымыз.'}",Талдыкорган,кулахметова шекер
2025-08-21,12:36:24,5,"Спасибо менеджеру Шекер Кулпхметова👍👍
Быстро, профессионально работает",Дамира Журкханова,1,"{'date_created': '2025-08-22T19:59:52.934489+07:00', 'id': '52265848', 'logo_preview_urls': {}, 'org_name': 'Freedom Bank', 'text': 'Добрый вечер, Дамира! Спасибо вам за теплые слова! Ждём вас снова 😉'}",Талдыкорган,
2025-08-20,14:12:20,5,"Кулахметова Шекер профессионал своего дела, одна из лучших менеджеров которого встречал",Мади Разаков,1,"{'date_created': '2025-08-20T18:29:12.757939+07:00', 'id': '52140038', 'logo_preview_urls': {}, 'org_name': 'Freedom Bank', 'text': 'Спасибо за приятный отклик 😉 Мы рады, что вам всё понравилось!'}",Талдыкорган,кулахметова шекер
2025-08-20,13:46:25,5,"Добрый день 
Менеджер Кулахметова Шекер очень добрый и отзывчивый человек, огромное спасибо вам качественное обслуживание",Азамат Азамат,2,"{'date_created': '2025-08-20T18:28:38.148274+07:00', 'id': '52139999', 'logo_preview_urls': {}, 'org_name': 'Freedom Bank', 'text': 'Добрый день, огромное спасибо за отзыв и оценку 🙏 Были рады помочь!'}",Талдыкорган,кулахметова шекер
2025-08-20,13:44:02,5,"Өте ыңғайлы Банк,менеджерлеріде сондай сыпайы әрі қарапайым.Кулахметова Шекерге көп-көп рахмет сұрақтарыма тез және сапалы жауап берді.",Айдын Кереев,1,"{'date_created': '2025-08-20T18:28:17.515457+07:00', 'id': '52139972', 'logo_preview_urls': {}, 'org_name': 'Freedom Bank', 'text': 'Айдын, сәлеметсіз бе. Кері байланыс бергеніңіз үшін үлкен рахмет, өте қуаныштымыз 😉 Сізге әрдайым қуанышпен қызмет көрсетеміз ❤'}",Талдыкорган,кулахметова шекер
2025-08-20,13:40:10,5,"Очень хороший банк,сотрудник Шекер Кулахметова очень помогла и все обьяснила подробно,рассказала как пользоватся приложение на ип",Beibit Chadambaev,1,"{'date_created': '2025-08-20T18:27:40.493175+07:00', 'id': '52139927', 'logo_preview_urls': {}, 'org_name': 'Freedom Bank', 'text': 'Beibit! Благодарим за отзыв и высокую оценку 🤗 Мы рады, что вам всё понравилось 💛'}",Талдыкорган,кулахметова шекер
2025-08-14,05:58:36,5,А вы дебетовые карты выпускаете?,Владислав Шин,0,"{'date_created': '2025-08-14T13:53:37.071173+07:00', 'id': '51795871', 'logo_preview_urls': {}, 'org_name': 'Freedom Bank', 'text': 'Добрый день! Да, конечно. Вы можете оформить дебетовую карту через мобильное приложение Freedom SuperApp или в отделении нашего банка.'}",Талдыкорган,
2025-08-13,15:19:26,5,"Отличный банк,первый раз подошла менеджеры девочки Динара,Гульфайруз,Шекер быстро помогли заявку отправить,и все подробно обьяснили,буду рекомендовать ваш банк",Куләндан Тоқталған,0,"{'date_created': '2025-08-13T17:01:03.022079+07:00', 'id': '51749119', 'logo_preview_urls': {}, 'org_name': 'Freedom Bank', 'text': 'Добрый день! Спасибо за тёплый отзыв 💚 \nРады, что наша команда смогла быстро и подробно помочь вам. Нам приятно слышать, что вы рекомендуете наш банк.'}",Талдыкорган,
2025-08-12,16:24:20,5,Иманғали Мадиевич топ сотрудник 🫰🏽,bo1atov__ _,0,"{'date_created': '2025-08-12T17:52:20.417125+07:00', 'id': '51687870', 'logo_preview_urls': {}, 'org_name': 'Freedom Bank', 'text': 'Добрый день! Спасибо за высокую оценку нашего сотрудника! Рады, что вы остались довольны обслуживанием.'}",Талдыкорган,
2025-08-12,16:23:28,5,Круто,Ризабек Ернарулы,0,"{'date_created': '2025-08-12T17:51:11.361097+07:00', 'id': '51687815', 'logo_preview_urls': {}, 'org_name': 'Freedom Bank', 'text': 'Добрый день! Спасибо за позитивный отзыв! Рады, что вам всё понравилось!'}",Талдыкорган,
2025-08-08,23:37:44,5,Кушти!,tald Fora,0,"{'date_created': '2025-08-09T14:22:50.955064+07:00', 'id': '51515977', 'logo_preview_urls': {}, 'org_name': 'Freedom Bank', 'text': 'Қайырлы күн! Пікіріңізге рақмет! Көңіліңізден шыққаны қуантады.'}",Талдыкорган,
2025-08-08,15:52:32,5,Кклахметова Шекерге көп рақмет! Өз ісін жақсы білетін маман.,Ainur Baimenova,1,"{'date_created': '2025-08-09T14:22:10.522431+07:00', 'id': '51515953', 'logo_preview_urls': {}, 'org_name': 'Freedom Bank', 'text': 'Қайырлы күн! Пікіріңізге рақмет. Қызметіміз көңіліңізден шыққанына қуаныштымыз.'}",Талдыкорган,
2025-08-08,13:46:11,5,Хорошее обслуживание,Aidar A.A,0,"{'date_created': '2025-08-09T14:21:47.350837+07:00', 'id': '51515939', 'logo_preview_urls': {}, 'org_name': 'Freedom Bank', 'text': 'Добрый день! Благодарим за ваш отзыв. Приятно, что вы остались довольны обслуживанием.'}",Талдыкорган,
2025-08-08,12:37:47,5,"Хочу поблагодарить Фридом Банк и особенно менеджера по работе с юридическими лицами Женисбекова Нуржана. Это действительно грамотный специалист, который всегда подробно объясняет все нюансы, помогает с документами и быстро решает любые вопросы. Чувствуется его искренний интерес к клиенту и желанию помочь. Благодаря его внимательному отношению, работать с банком стало намного проще и комфортнее. Желаю Нуржану успехов и дальнейшего карьерного роста!",Алуа Ибрай,0,"{'date_created': '2025-08-09T14:20:56.631408+07:00', 'id': '51515918', 'logo_preview_urls': {}, 'org_name': 'Freedom Bank', 'text': 'Добрый день! Благодарим за тёплые слова. Приятно знать, что работа наших сотрудников делает взаимодействие с банком для вас удобным и комфортным.'}",Талдыкорган,
2025-08-07,20:03:16,3,"Ой. Вроде продвинутый банк, но…. Оформлял мальтивалютную карту, так вот её оформляли 1,5 часа (какие-то непонятные анкеты и пр.), а дальше ещё хуже. Получал карту 45 минут",Александр Рыжков,0,"{'date_created': '2025-08-09T14:11:06.654746+07:00', 'id': '51515593', 'logo_preview_urls': {}, 'org_name': 'Freedom Bank', 'text': 'Добрый день! Мы сожалеем, что вы столкнулись с такой ситуацией. Пожалуйста, напишите нам в direct Instagram-аккаунта @bankffin.kz - мы разберёмся в проблеме и постараемся помочь.'}",Талдыкорган,
2025-07-27,22:22:47,5,сервис!,Aidyn Daribaev,0,"{'date_created': '2025-07-28T14:45:56.560805+07:00', 'id': '50813474', 'logo_preview_urls': {}, 'org_name': 'Freedom Bank', 'text': 'Добрый день! Спасибо за ваш положительный отзыв, нам очень приятно. Будем рады и дальше радовать вас сервисом!'}",Талдыкорган,
2025-07-27,17:20:40,1,Ненавижу этот банк самый худши,Ролик 🤪🔥🫂,0,"{'date_created': '2025-07-27T23:47:14.057513+07:00', 'id': '50771957', 'logo_preview_urls': {}, 'org_name': 'Freedom Bank', 'text': 'Добрый вечер!\nСожалеем, что у вас сложилось такое мнение.\nПожалуйста, напишите нам в direct @bankffin.kz— разберёмся в ситуации и постараемся помочь.'}",Талдыкорган,
2025-07-18,13:14:25,5,"Хочу выразить огромную благодарность супервайзеру Камалбековой Акботе, помогла все вопросы решить, очень вежливая, хорошо знает свою работу. В целом банку желаю процветания, стабильного успеха, много довольных клиентов",Анель Кудайберген,0,"{'date_created': '2025-07-19T19:18:59.671844+07:00', 'id': '50323529', 'logo_preview_urls': {}, 'org_name': 'Freedom Bank', 'text': 'Добрый вечер! Спасибо за ваш отзыв и добрые пожелания! Очень приятно знать, что вы остались довольны обслуживанием💚'}",Талдыкорган,акбота камалбекова
2025-07-18,12:46:26,5,"Обслуживалась в филиале Freedom Bank в Талдыкоргане и осталась в полном восторге 👍
Очень красивое отделение, видно сколько любви и внимания туда вложено. Сотрудники настоящие профессионалы, вежливые, красивые, всё чётко объясняют и отлично знают свою работу. Хотя филиал вроде открылся недавно.
Мобильное приложение Freedom установила давно, но только сейчас узнала какие у банка крутые продукты. Особенно удивил кешбэк, таких процентов ещё нигде не встречала.
Молодцы, спасибо за отличный сервис и подход 💚",Гулзат Смагулова,0,"{'date_created': '2025-07-19T19:15:09.931705+07:00', 'id': '50323388', 'logo_preview_urls': {}, 'org_name': 'Freedom Bank', 'text': 'Добрый вечер! Спасибо за такие добрые слова! Рады, что вам понравилось обслуживание и продукты нашего банка 💚'}",Талдыкорган,
2025-07-18,01:07:01,5,"Конечно поздно пишу отзыв но такое хорошее впечатление осталось от банка что весь вечер хожу счастливая.
Хочу выразить искреннюю благодарность банку Freedom за качественный сервис и внимательное отношение к клиентам. Особую благодарность хочу выразить менеджеру Оразай Айым. Это внимательный профессиональный и очень доброжелательный специалист👍
Обращение к ней оставило только положительные впечатления. Все объясняет понятно работает быстро и с душой. Видно что ей действительно важно помочь клиенту и сделать процесс максимально комфортным.
Также хочется отметить что в отделении очень хорошо встретили. Весь персонал работает оперативно и слаженно. Благодаря таким сотрудникам действительно хочется возвращаться именно в этот банк
Проблему решили сразу же. Спасибо за высокий уровень обслуживания и человеческое отношение. Успехов вам и дальнейшего процветания❤️",Гаухар Махметова,0,"{'date_created': '2025-07-19T19:14:26.991572+07:00', 'id': '50323358', 'logo_preview_urls': {}, 'org_name': 'Freedom Bank', 'text': 'Добрый вечер! Спасибо за ваш тёплый отзыв! Мы рады, что у вас остались такие положительные впечатления от обслуживания. Будем и дальше стараться оправдывать ваше доверие 💚'}",Талдыкорган,айым ержанқызы
2025-06-26,01:30:59,5,"Кулахметова Шекер зарекомендовала себя как высококвалифицированный менеджер, способный быстро и грамотно решать задачи любого уровня сложности. Её чёткое понимание процессов, ответственность и клиентоориентированный подход делают взаимодействие с банком максимально эффективным. Рекомендуем Шекер как надёжного и профессионального сотрудника.",Рахат Айтмырза,1,"{'date_created': '2025-06-30T15:09:39.777261+07:00', 'id': '49232670', 'logo_preview_urls': {}, 'org_name': 'Freedom Bank', 'text': 'Добрый день! Нам очень приятно, что визит в наше отделение оставил у вас положительные эмоции. Обслуживание клиентов на высоком уровне — наш приоритет.'}",Талдыкорган,кулахметова шекер
2025-06-25,23:33:41,5,"Спасибо менеджерам Кенжебекову Чингисхану и Женисбекову Нуржану за оперативную работу, профессионалы своего дела! Все объяснили внятно и понятно",Еламаня Бейсембаев,0,"{'date_created': '2025-06-30T15:09:24.698184+07:00', 'id': '49232635', 'logo_preview_urls': {}, 'org_name': 'Freedom Bank', 'text': 'Добрый день! Спасибо, что поделились своим впечатлением. Мы обязательно передадим ваши слова благодарности сотрудникам отделения. Это очень мотивирует!'}",Талдыкорган,
2025-06-25,14:28:06,5,Менеджер Кулахметова Шекер супер все подробно объяснила 👍🏻👍🏻👍🏻,Жансая Касымханқызы,0,"{'date_created': '2025-06-30T15:08:27.512559+07:00', 'id': '49232517', 'logo_preview_urls': {}, 'org_name': 'Freedom Bank', 'text': 'Добрый день! Спасибо за ваш отзыв! Такие слова поддержки помогают нам расти и совершенствовать сервис. Рады, что вам всё понравилось.'}",Талдыкорган,кулахметова шекер
2025-06-25,14:25:33,5,Очень приятные и отзывчивые сотрудники отдела! В особенности хочу отметить менеджера Шекер Кулахметова. Грамотно выполняет свою работу.,Д. А,0,"{'date_created': '2025-06-30T15:08:21.202658+07:00', 'id': '49232506', 'logo_preview_urls': {}, 'org_name': 'Freedom Bank', 'text': 'Добрый день! Очень приятно читать такие положительные отзывы. Мы ценим ваше доверие и постараемся его всегда оправдывать!'}",Талдыкорган,кулахметова шекер
2025-06-25,11:40:01,5,"Обслуживание отличное , особенно спасибо кассиру Шакировой Гульфайруз 👍 вежливая , ответственная , умеет работать с клиентами и это очень важно, всегда с улыбкой встречает . Приходишь с уверенностью к ней.",Салтанат Жайлыгулова,0,,Талдыкорган,гульфайруз шакирова
2025-06-24,20:01:06,5,"Хочу выразить искреннюю благодарность Кулахметовой Шекер — настоящему профессионалу своего дела! С первого же обращения она проявила внимательность, доброжелательность и высокий уровень компетентности. Все вопросы были решены оперативно, грамотно и с чётким объяснением каждого этапа. Особенно приятно удивила её забота о клиенте — Шекер не просто выполняет свою работу, а действительно помогает, искренне вовлечена в процесс и всегда стремится к наилучшему результату.
РЕКОМЕНДУЮ ВСЕМ!!!",Khassanov M,1,,Талдыкорган,кулахметова шекер
2025-06-24,14:28:02,5,Хороший банк🔥,Imangali Yntaly,2,"{'date_created': '2026-03-03T06:17:54.080115+07:00', 'id': '62216757', 'logo_preview_urls': {}, 'org_name': 'Freedom Bank', 'text': 'Доброй ночи! Спасибо за ваш отзыв, рады, что вы с нами. 💚'}",Талдыкорган,
2025-06-23,13:18:28,5,Сервис 10 из 10,Nargiza,0,"{'date_created': '2025-08-09T20:02:12.532845+07:00', 'id': '51528026', 'logo_preview_urls': {}, 'org_name': 'Freedom Bank', 'text': 'Добрый вечер! Благодарим за высокую оценку нашего сервиса!'}",Талдыкорган,
