id;дата;время;рейтинг;текст;автор;is_verified;is_hidden;hiding_type;likes_count;comments_count;official_answer;фото_count;provider;url
112013174;2024-09-21;16:07:09;1;УЖАСНАЯ компания!!! Если хотите сохранить свои деньги и самое главное нервы НИКОГДА не обращайтесь в эту компанию. Вот уже более 2-х недель не могут сделать возврат. Это ОБМАНЩИКИ с большой буквы. Мало того что обманули продав возвратные с штрафом билеты а указали что полностью возвратные. Так ещё и не подают на возврат в авиа компанию (подтвердила сама авиакомпания). А говорят что подали и ждут ответа. Обманщики!!!;Андрей Фёдоров;False;False;unrated_manual;2;1;{'date_created': '2024-09-23T12:53:51.837015+07:00', 'id': '35189341', 'logo_preview_urls': {}, 'org_name': 'Freedom Travel, агентство онлайн-бронирования билетов', 'text': 'Здравствуйте, нам очень важно разобраться в этой ситуации!\nДля проверки информации просим написать номер заказа или код бронирования.'};0;2gis;
108874336;2024-09-02;11:52:32;5;Лучший сервис покупки билетов. Профессиональные ребята. 10 лет покупаем только через них. Служба поддержки круглосуточная. Даже бабушкам все объясняют доходчиво.;J. Oss.;False;False;;2;1;{'date_created': '2024-09-02T12:58:43.695824+07:00', 'id': '34225400', 'logo_preview_urls': {}, 'org_name': 'Freedom Travel, агентство онлайн-бронирования билетов', 'text': 'Благодарим за отзыв 💚'};0;2gis;
106680210;2024-08-21;20:10:10;1;Глупая менеджер Светлана. Местонахождение указывает УЛИЦА ГАГАРИНА (которая находится совсем в другом районе Алматы), вместо проспекта Гагарина. Лишь после третьего раза удалось правильно установить местонахождение.;Окс Прусова;False;False;unrated_manual;0;1;;0;2gis;
104400291;2024-08-09;10:30:10;1;сомнительная организация, сделала возврат билета в одну сторону, деньги не перечислили служба поддержки молчит в чате;Aizhan Teketbayeva;False;False;;5;1;{'date_created': '2024-08-09T11:16:15.07383+07:00', 'id': '33154306', 'logo_preview_urls': {}, 'org_name': 'Freedom Travel, агентство онлайн-бронирования билетов', 'text': 'Здравствуйте, нам очень важно разобраться в данной ситуации! Пожалуйста подскажите номер вашего телефона или заказа для проверки информации?'};0;2gis;
103029727;2024-08-07;21:36:32;1;"Билеты дорогие , лучше пользуйтесь другими приложениями или сайтом авиакомпании.
Если рейс отменили по вине авиакомпании то готовьтесь АВИАТА не захочет его вернуть вообще . Рассмотрение 60 рабочих дней! 
И то не известно все еще вернут или нет";Жер ҒаламшарыныңАзаматы;False;False;;4;3;{'date_created': '2024-08-08T11:52:23.916622+07:00', 'id': '33109765', 'logo_preview_urls': {}, 'org_name': 'Freedom Travel, агентство онлайн-бронирования билетов', 'text': 'Здравствуйте!\nНам очень важно разобраться в сложившейся ситуации. Для этого просим написать номер заказа и свой контактный телефон, по которому мы могли бы с вами связаться, спасибо!'};1;2gis;
87013700;2024-06-18;20:05:05;4;Спасибо, мне сделали возврат средств.;Gulnara Zharylgapova;False;False;;0;0;;0;2gis;
80027725;2024-04-24;04:58:17;1;"Я столкнулся с серьёзной проблемой при возврате авиабилетов, приобретённых через компанию Авиата, на сумму свыше 2,5 миллионов тенге. Прошло уже более недели, но наши обращения остаются без ответа со стороны сотрудников компании. Призываю жителей Казахстана не ограничиваться публикацией отзывов, а принять меры к подаче коллективного иска, чтобы положить конец этим неправомерным действиям.

Многократные звонки в колл-центр компании превращаются в истощающий процесс: каждый раз приходится общаться с новым оператором и объяснять свою проблему с нуля, что неминуемо ведет к изнурению и эмоциональному истощению клиентов. Ответы, которые предоставляются операторами, остаются шаблонными и не приносят решения возникшим вопросам. Я призываю всех, кто столкнулся с подобным недобросовестным подходом со стороны агрегатора, не оставаться в стороне и продолжать борьбу за свои права. В нашем правовом государстве каждый из нас имеет полное право и законные основания добиваться справедливости и возмещения убытков через судебные органы.";Антуан Лепорье;False;False;;9;1;{'date_created': '2024-04-24T06:12:51.111799+07:00', 'id': '28680246', 'logo_preview_urls': {}, 'org_name': 'Freedom Travel, агентство онлайн-бронирования билетов', 'text': 'Здравствуйте!\nНам очень важно разобраться в сложившейся ситуации, поэтому просим вас написать нам отзыв на почту help@aviata.kz, а так оставить в письме номер заказа и свой контактный телефон, по которому мы могли бы с вами связаться, спасибо!'};0;2gis;
77422399;2024-03-29;14:16:47;5;Колл центр супер ❤️❤️❤️;Юлия Пашинцева;False;False;;2;1;{'date_created': '2024-03-29T16:16:23.595865+07:00', 'id': '27644039', 'logo_preview_urls': {}, 'org_name': 'Freedom Travel, агентство онлайн-бронирования билетов', 'text': 'Благодарим за отзыв 💚'};0;2gis;
75852746;2024-03-12;15:41:28;5;На днях купил билеты, были некоторые проблемы, но менеджера помогли ❤;Алия Муратовна;False;False;;2;1;{'date_created': '2024-03-12T18:08:32.040592+07:00', 'id': '26998766', 'logo_preview_urls': {}, 'org_name': 'Freedom Travel, агентство онлайн-бронирования билетов', 'text': 'Благодарим за отзыв 💚'};0;2gis;
72217030;2024-02-02;12:58:24;1;"Здравствуйте. Руководству данной организации ""Авиато"" прошу Вас принять меры в отношении некоторых сотрудников: сервис ужасный, обслуживала девушка сначало одна потом вторая, такие грубиянки как будто сидят на базаре. Естественно какому человеку это понравится?";Азамат Суанкулов;False;False;;2;1;{'date_created': '2024-02-05T11:57:01.832585+07:00', 'id': '25683169', 'logo_preview_urls': {}, 'org_name': 'Freedom Travel, агентство онлайн-бронирования билетов', 'text': 'Здравствуйте!\nНам очень важно разобраться в сложившейся ситуации, поэтому просим вас написать нам отзыв на почту help@aviata.kz , а также оставить в письме номер заказа и свой контактный телефон, по которому мы могли бы с вами связаться, спасибо!'};0;2gis;
71850912;2024-01-29;11:29:12;1;"Никакой ответственности от компании , если возникают проблемы на рейсы они только одно и говорят что не несут ответственности.
Полное разочарование.";Дильназ Марисова;False;False;;1;1;{'date_created': '2024-01-30T10:28:49.979567+07:00', 'id': '25480404', 'logo_preview_urls': {}, 'org_name': 'Freedom Travel, агентство онлайн-бронирования билетов', 'text': 'Здравствуйте!\nНам очень важно разобраться в сложившейся ситуации, поэтому просим вас написать нам отзыв на почту help@aviata.kz , а также оставить в письме номер заказа и свой контактный телефон, по которому мы могли бы с вами связаться, спасибо!'};0;2gis;
71082072;2024-01-20;13:43:40;5;"Авиакомпания перенесла время рейса, из-за чего уже не успевал на стыковку.
Благодаря Авиате быстро и бесплатно поменял билет на другое время";Валентин Николаев;False;False;;4;1;{'date_created': '2024-01-21T11:01:39.329824+07:00', 'id': '25166826', 'logo_preview_urls': {}, 'org_name': 'Freedom Travel, агентство онлайн-бронирования билетов', 'text': 'Благодарим за отзыв! 💚'};0;2gis;
69210658;2023-12-28;22:01:45;2;Билетті осы жерден алып жүрмін,бірақ соңғы кездері ұнамай жүр. Сатып алған билетті көрі үшін,активные дегенбі басам ал онда билет жоқ;Акбота Камбар;False;False;;1;1;{'date_created': '2023-12-29T10:22:38.918871+07:00', 'id': '24529181', 'logo_preview_urls': {}, 'org_name': 'Freedom Travel, агентство онлайн-бронирования билетов', 'text': 'Сәлеметсіз бе!\nБіз үшін жағдайды түсіну өте маңызды, сондықтан біздiң поштамызға пікір жазуыңызды сұраймыз help@aviata.kz , сондай-ақ, сізбен хабарласа алатын байланыс телефон нөміріңізді хатта қалдырыңыз, рахмет!'};0;2gis;
68381811;2023-12-20;11:32:56;1;Ужасный сервис, купила жд билеты, нам отменили поезда в связи с чс, деньги не хотят возвращать. Часть вернули, за сервис сборы не собираются возвращать, хотя услуга не была оказана.;Ирина Хегай;False;False;;4;1;{'date_created': '2023-12-20T13:47:41.571427+07:00', 'id': '24244020', 'logo_preview_urls': {}, 'org_name': 'Freedom Travel, агентство онлайн-бронирования билетов', 'text': 'Здравствуйте!\nНам очень важно разобраться в сложившейся ситуации, поэтому просим вас написать нам отзыв на почту help@aviata.kz , а также оставить в письме номер заказа и свой контактный телефон, по которому мы могли бы с вами связаться, спасибо!'};0;2gis;
68153191;2023-12-17;17:45:11;1;"Я хотела сделать возврат денег,объяснила мою ситуацию,отправила нужны документы,на вынужденный возврат денег,но они не хотят возвращать,якобы эти документы не хватить для возвращения,повторяет одно и тоже,можете сделать обмен на другую сумму с доплатой🤦🏻‍♀️,и зачем мне обмен, и если тут мой ребенок болеет, а за обмен штраф берете на 6450 тг, а деньги возвращать нехотите, вообще ужасно,оператором вообще
плевать на ваши проблемы, еще отвечает очень долго, пока ждешь от него ответа прошло уже целый час, кто том Руслан-253,Рамилям-201,Самый худший

компания,никаких уважение клиентам";Жұлдыз Есен;False;False;;4;2;{'date_created': '2023-12-19T12:40:51.631743+07:00', 'id': '24204244', 'logo_preview_urls': {}, 'org_name': 'Freedom Travel, агентство онлайн-бронирования билетов', 'text': 'Здравствуйте!Мы внимательно изучили предоставленную вами справку за декабрь и обнаружили расхождение: фактический вылет по билету был в апреле, в отличие от указанного в справке. Эту информацию подтверждали наши сотрудники в предыдущих консультациях.Запрос на вынужденный возврат будет направлен в авиакомпанию только после предоставления актуальной справки, отражающей дату фактического вылета в апреле.Так как наш специалист не смог с вами связаться, информация по вынужденному возврату была отправлена в чате заказа.'};0;2gis;
67161001;2023-12-06;16:45:59;1;"Делают вид что заинтересованы в ваших проблемах… за 920к купил у них проблем 😆 
Слава богу есть место для коментов… помните они хорошие пока нет проблем….. ка качнуть я проблемы… они найдут 1000сылок на то что бы найти крайнего … а по факту даже к партнерам обратись не могут… для вразумительного ответа ❤️Казахстан ван лав";Daniyar Rozybakiyev;False;False;;6;3;{'date_created': '2023-12-07T13:42:47.936495+07:00', 'id': '23833148', 'logo_preview_urls': {}, 'org_name': 'Freedom Travel, агентство онлайн-бронирования билетов', 'text': 'Здравствуйте!\nНам очень важно разобраться в сложившейся ситуации, поэтому просим вас написать нам отзыв на почту help@aviata.kz , а также оставить в письме свой контактный телефон, по которому мы могли бы с вами связаться, спасибо!'};0;2gis;
65407498;2023-11-18;10:40:09;1;Поменяйте пожалуйста номер ваши номера не зарегистрирован и отключена👎👎👎👎;Айжан Даулетовна;False;False;;3;1;{'date_created': '2023-11-18T13:17:14.97243+07:00', 'id': '23211245', 'logo_preview_urls': {}, 'org_name': 'Freedom Travel, агентство онлайн-бронирования билетов', 'text': 'Здравствуйте!\nПриносим извинения за неудобства.\nК сожалению, в данный момент наблюдаются технические неполадки и ведутся технические работы с телефонией.'};0;2gis;
64555466;2023-11-08;12:42:59;5;Покупала билет с оплатой 2050 тг за гарантию 90 процентов возврата компания Air Astana,летели с животным. В итоге самолёт вылетел из Алматы в Шымкент,перед посадкой развернулся и полетел назад в Алматы. Якобы ветер сильный,хотя в это же время другие самолёты совершали взлет и посадку . Не могли долго ждать,когда самолёт все же полетит,потому что перевозили животное. Сошли,деньги нам сначала не вернули,хотя это вина авиакомпании,что мы не долетели. А на 90 процентов возврата нам ответили,что билет по нашему тарифу возврату не подлежит и гарантия на него не действует,хотя почему в приложении эта гарантия предлагается и я ее почти всегда оплачивала. Но через некоторое время всё-таки вернули 90 процентов от стоимости билета, спасибо что разобрались!В начале была недовольна и написала плохой отзыв, теперь вот изменила. Столько лет пользовалась приложением,было такое разочарование ,но теперь вот очень благодарна! Всё-таки осталась довольна как обычно!;SaP gyn_kz Laktionova M. V.;False;False;;2;2;{'date_created': '2023-11-08T13:04:23.907619+07:00', 'id': '22880066', 'logo_preview_urls': {}, 'org_name': 'Freedom Travel, агентство онлайн-бронирования билетов', 'text': 'Здравствуйте! Для проверки информации, просим указать код брони или номер заказа.'};0;2gis;
64555288;2023-11-08;12:40:33;1;Уже 3 месяца прошло а возврат денег нету, говорят отправили а банк это не видит, куда делась никто не знает, если отправили то он же должен поступить на счет, бардак какой та;Асем Бакытжанкызы;False;False;;3;1;{'date_created': '2023-11-08T13:05:01.948053+07:00', 'id': '22880090', 'logo_preview_urls': {}, 'org_name': 'Freedom Travel, агентство онлайн-бронирования билетов', 'text': 'Здравствуйте!\nПросим указать код брони, номер билета, телефона или номер заказа, к которому относится данное обращение.'};0;2gis;
64389685;2023-11-06;17:32:39;1;"Выкупила билеты в направлении Алматы-Уральск-Алматы бизнес!, рейс отменили, перебила на следующий, который предложил маршрут Алматы-Актюбинск до Уральска на транспорте тоже переносили два раза. Я не согласилась оформила возврат. В итоге делают возврат с удержанием штрафа. Это возмутительно!
Не пользуйтесь услугами данной компании!!!
Пользуйтесь каспий тревал, моментальные возвраты без штрафов!";Айнагуль Айтимова;False;False;;3;1;{'date_created': '2023-11-08T13:05:42.049889+07:00', 'id': '22880116', 'logo_preview_urls': {}, 'org_name': 'Freedom Travel, агентство онлайн-бронирования билетов', 'text': 'Здравствуйте!\nПросим указать код брони, номер билета, телефона или номер заказа, к которому относится данное обращение. Мы проверим информацию.'};0;2gis;
62903920;2023-10-19;18:27:35;1;Покупал билет Алматы-Торонто на 2 октября по 11 октября. В связи с острой болезнью не смог сесть на свой рейс и подал на вынужденный возврат билетов. Отправил все документы подтверждающие, что я был действительно болен, и лежал в больнице. В ответ, от менеджеров я получил отказ, что якобы тариф по купленному билету не рассматривает вынужденный возврат и никакие мои справки, анализы о болезни недействительны. То есть получается, если я попаду в ДТП, сильно покалечусь, то на рейс я должен буду в таком состоянии лететь??? Где логика? Зачем тогда внедрять возможность возвращать средства по вынужденным обстоятельствам? Попробовал обмен, там сумма сильно колебалась, и меня предупредили, что сумма может изменится и возможно придется доплатить. Я не стал обменивать свой билет из-за опасения и страха, что они мне двойную сумму потом заставят доплачивать. Вернул средства через стандартный возврат, и мне вернули какой-то мизер от оригинальной суммы покупки билета. По итогу хочу сказать, что данная компания является той, которая кидает на деньги и пользуется своим положением и не боится законов. Я так понимаю, что они не церемонятся с законами о правах потребителей. Удалил мобильное приложение. Больше никогда не буду использовать данный сервис!;Bauyrzhan Muratbek;False;False;;4;0;;0;2gis;
62400831;2023-10-13;19:53:59;5;Быстро обслужили, очень помогли в выборе билетов. Спасибо большое!;Алла Морозова;False;False;;2;0;;0;2gis;
62326472;2023-10-12;21:09:27;1;"Ужасная компания!!!
Покупал у них авиабилеты Алматы-Москва и Москва-Алматы, аэропорт прибытия и аэропорты вылета перепутали, когда оформляли, едва успел на рейс… Кроме как «Извините, техническая неполадка» ничего не предложили и не компенсировали!!!
Была бы возможность ставить минус 5 звезд, я бы их и поставил!!!
Никакой клиентоориентированности!!!";Данияр Муканов;False;False;;6;0;;0;2gis;
60565508;2023-09-19;11:02:33;5;Спасибо большое сотрудникам! Решили все мои вопросы за 15 минут😊 очень благодарна;Kuralai Kanibek;False;False;;3;0;;0;2gis;
60277945;2023-09-15;12:48:36;5;Компания просто топ🔥💚;Альбина Бердибек;False;False;;3;0;;0;2gis;
