id;дата;время;рейтинг;текст;автор;is_verified;is_hidden;hiding_type;likes_count;comments_count;official_answer;фото_count;provider;url
179882197;2025-08-20;12:59:53;5;Ура, пришел возврат за авиабилеты!☺️ Благодарю за помощь оператора Тимура, который дал мне подробную консультацию и помог оформить возврат. Приятно работать с компанией, для которой важны клиенты🤗;Кира Цаголова;False;False;;0;1;{'date_created': '2025-08-20T13:20:45.869558+07:00', 'id': '52116658', 'logo_preview_urls': {}, 'org_name': 'Freedom Travel, агентство онлайн-бронирования билетов', 'text': 'Спасибо большое за ваш отзыв — нам очень приятно знать, что вы остались довольны обслуживанием.\nОбязательно передадим благодарность Тимуру — такие слова вдохновляют нашу команду продолжать помогать с заботой и вниманием.\nРады, что смогли быть полезными! Обращайтесь в любое время — всегда готовы помочь 😊'};0;2gis;
179763094;2025-08-19;20:26:53;1;5 дней пытаюсь выкупить билет.Пять дней одно и то же:все заполняю,переходим на оплату и выходит окно:сейчас невозможно забронировать,технический сбой,попробуйте позже...Позже это когда?5 дней нет сервиса.;Svitlana Sokurova;False;False;;0;1;{'date_created': '2025-08-19T22:13:09.204369+07:00', 'id': '52090722', 'logo_preview_urls': {}, 'org_name': 'Freedom Travel, агентство онлайн-бронирования билетов', 'text': 'Здравствуйте!\nНам очень жаль, что у вас остались такие впечатления. Хотим разобраться в ситуации и всё тщательно проверить.\nПожалуйста, сообщите номер бронирования или заказа — мы уточним информацию и постараемся вам помочь.'};0;2gis;
179670097;2025-08-19;13:36:56;5;Практически каждый месяц покупаю билеты через Фридом. Удобная платформа. В поддержку приходилось обращаться буквально пару раз, и каждый раз я был очень благодарен за помощь, так как дело касалось отмены рейсов. Постоянно были на связи и помогали, спасибо!;Владимир Шестаков;False;False;;0;1;{'date_created': '2025-08-19T13:56:31.516122+07:00', 'id': '52057101', 'logo_preview_urls': {}, 'org_name': 'Freedom Travel, агентство онлайн-бронирования билетов', 'text': 'Здравствуйте!\n\nБлагодарим за ваш отзыв и доверие к нашему сервису. Мы рады, что вы остаетесь с нами и цените удобство платформы и оперативную поддержку. Ваши слова вдохновляют нас продолжать работать над улучшением качества обслуживания.\n\nЕсли у вас возникнут дополнительные вопросы или потребуется помощь, не стесняйтесь обращаться. Мы всегда готовы помочь вам в организации ваших путешествий.💚'};0;2gis;
179655291;2025-08-19;12:17:33;5;"Давно уже покупаю ж/д билеты только онлайн, и в последние месяцы пользуюсь ""Фридом Трэвел"". Два раза брал туда-обратно и сэкономил по 7000 тенге.";Санжар Эльдарох;False;False;;0;0;;0;2gis;
179533958;2025-08-18;19:48:12;5;Была не уверена, что поездка состоится (зависело от того согласуют ли отпуск), а билет надо было брать, иначе не будет. В поддержке подсказали про гарантию возврата, стоило недорого - 10% от стоимости билета, зато в случае чего сумму бы полностью вернули. Поездка в итоге не отменилась, но как же мне было спокойно с этой гарантией - а так и без отпуска и без денег остаться могла.;Валерия Янковская;False;False;;0;1;{'date_created': '2025-08-18T20:36:10.877898+07:00', 'id': '52022113', 'logo_preview_urls': {}, 'org_name': 'Freedom Travel, агентство онлайн-бронирования билетов', 'text': 'Благодарим вас за отзыв.\nРады, что услуга гарантии возврата оказалась полезной и помогла вам чувствовать себя увереннее при бронировании.\nПриятно знать, что поездка состоялась — желаем вам комфортных и удачных путешествий! ✈💚'};0;2gis;
178875309;2025-08-15;17:54:21;5;"в первый раз заказал авиабилеты на этой платформе, впечатления позитивные.

пришлось обращаться в поддержку, по всем вопросам проконсультировали, быстро и по делу, спасибо.

полет прошел успешно, вообще ничего не омрачило путешествие";Ольга Самсонова;False;False;;0;1;{'date_created': '2025-08-18T20:38:51.151496+07:00', 'id': '52022325', 'logo_preview_urls': {}, 'org_name': 'Freedom Travel, агентство онлайн-бронирования билетов', 'text': 'Спасибо, что выбрали Freedom Travel впервые и поделились своим опытом.\nМы очень рады, что наша служба поддержки оперативно помогла вам, и что полёт прошёл удачно.\n\nБудем рады видеть вас снова и помочь в организации новых путешествий.✈💚'};0;2gis;
178846431;2025-08-15;15:52:10;5;Пять баллов, хороший и нужный сервис, с недавних пор путешествую только здесь, приложение удобное, много выгодных предложений👍👍;Егор Щербаков;False;False;;0;1;{'date_created': '2025-08-18T20:37:11.301099+07:00', 'id': '52022187', 'logo_preview_urls': {}, 'org_name': 'Freedom Travel, агентство онлайн-бронирования билетов', 'text': 'Благодарим вас за высокую оценку и доверие!\nНам очень приятно, что вы выбираете наш сервис для своих поездок.\nРады, что приложение оказалось удобным, а предложения — выгодными. Будем стараться и дальше! ✈💚'};0;2gis;
178681915;2025-08-14;19:52:25;5;Спасибо за отличное путешествие! Удалось подобрать хороший тур в Дубай по адекватной цене. Анализировали с мужем много вариантов, в итоге после подсчетов пришли к выводу, что вариант от Фридом тревэл дает экономию почти в 25к по сравнению с аналогичным уровнем на других площадках. Особенно понравилось, что кешбэк распространяется и на туры в рассрочку. Поэтому смогли позволить себе чуть больше, чем планировали. Оформили рассрочку на полгода, без сложностей, только пару моментов уточнили в поддержке. Отвечают там, кстати, быстро и вежливо, специалисты толковые. Будем обращаться!;Любовь Пудина;False;False;;0;1;{'date_created': '2025-08-15T11:05:57.906506+07:00', 'id': '51844064', 'logo_preview_urls': {}, 'org_name': 'Freedom Travel, агентство онлайн-бронирования билетов', 'text': 'Спасибо, что поделились впечатлениями! Очень рады, что оформление тура было удобным и выгодным. Отличных вам путешествий и новых ярких впечатлений!'};0;2gis;
178680429;2025-08-14;19:46:31;5;Солидный кешбек за авиа, аналогов у нас я не встречал. По итогу билеты самые выгодные, особенно есть летаешь часто. Плюс экономия времени, так как кабинет удобный, данные сохраняются. Бронирование проходит в пару кликов, включая выбор места. Респект разработчикам, действительно хорошая система.;Игорь Антонович;False;False;;0;1;{'date_created': '2025-08-15T11:08:23.302315+07:00', 'id': '51844149', 'logo_preview_urls': {}, 'org_name': 'Freedom Travel, агентство онлайн-бронирования билетов', 'text': 'Спасибо за отзыв! Рады, что наш сервис и кешбэк делают перелёты удобнее и выгоднее. Будем стараться радовать вас и дальше!'};0;2gis;
178679367;2025-08-14;19:42:28;5;Летали во Вьетнам, взяли пакетный тур. В принципе все устроило, тем более что попали на акцию с рассрочкой на два года :);Наталья Сергеева;False;False;;0;1;{'date_created': '2025-08-15T11:10:19.496454+07:00', 'id': '51844224', 'logo_preview_urls': {}, 'org_name': 'Freedom Travel, агентство онлайн-бронирования билетов', 'text': 'Спасибо, что выбрали нас для поездки! Рады, что тур и условия вам подошли.'};0;2gis;
178399645;2025-08-13;16:18:00;1;Не советую пользоваться этой компанией. Покупали билет, возвратный тариф! В итоге, билеты оказались возврат с огромными штрафами! Буду писать жалобу, дойду до суда, но свои права отстою!;Aa La;False;False;;0;3;{'date_created': '2025-08-13T17:27:48.526294+07:00', 'id': '51750998', 'logo_preview_urls': {}, 'org_name': 'Freedom Travel, агентство онлайн-бронирования билетов', 'text': 'Здравствуйте!\nХотим разобраться в вашей ситуации. Подскажите, пожалуйста, номер заказа или брони, чтобы мы могли всё проверить и помочь.'};0;2gis;
178257776;2025-08-12;22:13:15;5;Покупал в рассрочку тур для себя и девушки, получил кешбек. Страховку тоже оформили через этот сервис. Нормально отдохнули в турецком олл инклюзиве)) Думаю, что перед Новым годом снова полетим с Фридом Тревел на теплые моря));Глеб Лобачевский;False;False;;0;1;{'date_created': '2025-08-13T10:57:01.037907+07:00', 'id': '51721801', 'logo_preview_urls': {}, 'org_name': 'Freedom Travel, агентство онлайн-бронирования билетов', 'text': 'Спасибо за отзыв!\nРады, что отдых удался и сервис понравился.\nЖдём вас снова за новыми тёплыми путешествиями💚'};0;2gis;
178254404;2025-08-12;21:58:17;5;"Пользуюсь из-за частых деловых перелетов. Кешбек 14% чувствителен даже на одном билете, а когда каждый месяц приходится вылетать несколько раз, в том числе за рубеж, это уже очень серьезная помощь бюджету.

Сервис тоже на высоте. На прошлой неделе оператор мне здорово помог при отмене рейса. Рейс отменили в зарубежном аэропорту, поэтому я волновался, удастся ли связаться с поддержкой и поможет ли она мне. Беспокоил даже не столько возврат денег, сколько необходимость успеть на стыковочный рейс.

Но всё разрулили. Подключились к решению вопроса мгновенно, на звонок в вотсапе ответили без долгого ожидания. От всей души благодарю!";Филипп Валмасов;False;False;;0;1;{'date_created': '2025-08-13T10:52:09.879467+07:00', 'id': '51721621', 'logo_preview_urls': {}, 'org_name': 'Freedom Travel, агентство онлайн-бронирования билетов', 'text': 'Здравствуйте!\nСпасибо большое за тёплый отзыв!\nОчень приятно знать, что наша поддержка помогла вам в сложной ситуации.\nМы всегда рядом, чтобы сделать ваши путешествия комфортными💚'};0;2gis;
177976085;2025-08-11;17:54:28;5;Регулярно езжу к дочери и в последнее время стала брать билеты через Фридом Тревел. Экономия за счет кешбека ощутимая - вместо 21 тысячи отдала чуть меньше 19. Всегда заказываю билет в женский вагон, где мне комфортно. Да и вообще много полезных опций, при этом все понятно и удобно. Сейчас еду в поезде и решила написать маленький отзыв - настроение хорошее. Спасибо за сервис и кешбек🙏;Дарья Антонова;False;False;;0;1;{'date_created': '2025-08-11T21:37:00.701099+07:00', 'id': '51638434', 'logo_preview_urls': {}, 'org_name': 'Freedom Travel, агентство онлайн-бронирования билетов', 'text': 'Здравствуйте!\nНам очень приятно получать такие тёплые слова 💚 Спасибо, что выбираете нас и делитесь своими впечатлениями. Желаем вам всегда только приятных дорог и хорошего настроения!'};0;2gis;
177342296;2025-08-08;19:15:24;5;удобная функция подписки на открытие продаж. езжу к родственникам на праздники, а перед праздниками уехать сложно. все всегда раскуплено, но если я бронирую билеты среди первых, то проблема решена. главное не пропустить этот момент. когда приходит уведомление, сразу все бросаю и покупаю билет. бывает денег нет, но спасибо, что дают возможность забронировать с символической предоплатой в 5%.;Marat Denisov;False;False;;0;1;{'date_created': '2025-08-08T21:46:44.150398+07:00', 'id': '51497625', 'logo_preview_urls': {}, 'org_name': 'Freedom Travel, агентство онлайн-бронирования билетов', 'text': 'Спасибо за отзыв! 💚✈️ Рады, что подписка помогает вам бронировать вовремя и удобно. Все— для вашего комфорта. Спасибо, что выбираете нас!'};0;2gis;
177122414;2025-08-07;19:04:06;5;Удобный сервис, надежный. Если что-то непонятно, всегда помогают. Поддержка работает профессионально, отвечают быстро.;Виталий Козырев;False;False;;0;1;{'date_created': '2025-08-07T19:52:29.790251+07:00', 'id': '51425675', 'logo_preview_urls': {}, 'org_name': 'Freedom Travel, агентство онлайн-бронирования билетов', 'text': 'Благодарим за тёплые слова! Очень приятно знать, что наш сервис и поддержка всегда рядом и помогают вам. 💚✈️'};0;2gis;
176893273;2025-08-06;17:22:55;5;Хочу сказать спасибо операторам поддержки! Не в первый раз покупаю билеты на поезд через Фридом Тревел, обычно никаких приключений)) Но в этот раз возникли срочные дела, задержавшие в Актау. Пришлось менять билет, все в приложении сделала, уехала через два дня, в деньгах не потеряла));Милена Абрашина;False;False;;0;1;{'date_created': '2025-08-07T19:53:37.447424+07:00', 'id': '51425734', 'logo_preview_urls': {}, 'org_name': 'Freedom Travel, агентство онлайн-бронирования билетов', 'text': 'Спасибо большое за ваш отзыв и доверие! Рады, что поддержка помогла оперативно решить вопрос, а поездка прошла без потерь. Пусть ваши путешествия всегда будут приятными! 💚✈️'};0;2gis;
176763317;2025-08-05;23:53:48;5;Покупал здесь авиабилет, довольно удобно и выгодно. Практически перед отлетом смог добавить дополнительный багаж - сразу не рассчитал. Что особо порадовало - поддержка живая! Люди отвечают и помогают, а не роботы👍;Роберт Григорьев;False;False;;0;1;{'date_created': '2025-08-06T00:10:22.906343+07:00', 'id': '51320778', 'logo_preview_urls': {}, 'org_name': 'Freedom Travel, агентство онлайн-бронирования билетов', 'text': 'Спасибо большое за отзыв! 😊\n\nМы рады, что вам понравился наш сервис и что поддержка оказалась полезной. Всегда стараемся сделать ваше путешествие максимально комфортным! 💚'};0;2gis;
176695565;2025-08-05;18:40:16;5;Отличный сервис для покупки семейных туров – с рассрочкой и кешбэком. Что для нас и стало главным аргументом, так как отпуск с детьми удовольствие не из дешевых... Уезжали всей семьёй в Таиланд и бронирование прошло беспроблемно, во многом благодаря поддержке. В ватцапе отвечают сразу, причем в любое время – даже в четыре утра. В итоге тур купили, МСТ оформили. Сэкономили благодаря кешбеку почти 30 000 тенге.;Ира Шулянская;False;False;;0;1;{'date_created': '2025-08-05T19:12:53.569038+07:00', 'id': '51305791', 'logo_preview_urls': {}, 'org_name': 'Freedom Travel, агентство онлайн-бронирования билетов', 'text': 'Благодарим за тёплый отзыв!\nРады, что всё прошло удобно, а кешбэк и рассрочка сделали поездку комфортнее. Будем рады помочь и с будущими путешествиями💚'};0;2gis;
176072184;2025-08-02;20:00:33;1;Купил в приложении билет. Компания перевозчик прислала что переносит рейс. Сделал возврат через приложение. Ответ ждал больше 5 часов. Сказали, что невозвратный только когда сам позвонил (возврат был возможен если был перенос более чем на 5 часов). Из за этого неуспели в аэропорт. Ни билета, ни денег. Авиата говорит, что она всегда на связи и помогает клиентам. Получается немного не так. Грустно.;Artyom Prima;False;False;;0;3;{'date_created': '2025-08-02T20:48:42.172892+07:00', 'id': '51119004', 'logo_preview_urls': {}, 'org_name': 'Freedom Travel, агентство онлайн-бронирования билетов', 'text': 'Здравствуйте!\nНам искренне жаль, что у вас остались такие впечатления. Хотим разобраться в ситуации и всё проверить.\nПожалуйста, подскажите номер брони или заказа - уточним детали и постараемся помочь.'};0;2gis;
175929442;2025-08-02;00:40:32;1;Очень разочарован компанией, купил билет хотел добавить ребёнка в приложении не получилось, написал в поддержку эффекта ноль, позвонил менеджеру и тут началось мы добавить ребёнка не сможем мы просто провайдеры обращайтесь в авиакомпанию сами,предложили сделать возврат билета чтобы купить новый без ошибок. Возврат оформляют очень неохотно, всю информацию нужно тащить клещами,один специалист говорит деньги поступят через несколько минут, жду несколько часов нету, звоню другой говорит в течении 10 дней, не серьёзно. И какие 10 дней билет нужно купить сегодня а деньги не возвращают. Тем более оплачивал с Фридом Банка в чем проблема? Не советую пользоваться услугами этой компании!;Сергей Рыбников;False;False;;0;3;{'date_created': '2025-08-02T13:50:34.218136+07:00', 'id': '51104194', 'logo_preview_urls': {}, 'org_name': 'Freedom Travel, агентство онлайн-бронирования билетов', 'text': 'Здравствуйте!\nОчень жаль, что у вас остались такие впечатления. Хотим разобраться в ситуации и помочь - пожалуйста, напишите номер вашего заказа или бронирования, мы всё уточним и обязательно свяжемся с вами.'};0;2gis;
175334472;2025-07-30;10:45:36;5;хороший сервис.;ruana;False;False;;0;1;{'date_created': '2025-07-30T11:20:26.761554+07:00', 'id': '50930128', 'logo_preview_urls': {}, 'org_name': 'Freedom Travel, агентство онлайн-бронирования билетов', 'text': 'Здравствуйте! Спасибо большое, очень приятно получать обратную связь!'};0;2gis;
