id;дата;время;рейтинг;текст;автор;is_verified;is_hidden;hiding_type;likes_count;comments_count;official_answer;фото_count;provider;url
26401420;2022-01-13;18:18:46;1;Интересно, тишина, не дозвониться. Походу ждать возврата очень долго будем.;Алия Орынова;False;False;;5;1;{'date_created': '2022-01-21T17:07:43.502855+07:00', 'id': '8743154', 'logo_preview_urls': {}, 'org_name': 'Freedom Travel, агентство онлайн-бронирования билетов', 'text': 'Здравствуйте. \nНам требуется еще пара дней и мы восстановим телефонию и прежнюю скорость работы.\nЗаканчиваем обработку заявок, поступивших за период ЧП.\nЕсли мы уже обработали вашу заявку на возврат, деньги поступят в течение нескольких дней.\nНе переживайте, ни одна заявка не останется без внимания'};0;2gis;
26398205;2022-01-13;16:17:26;1;Дд, на почту написала 4 дня назад , до сих пор нет ответа , звонишь сбрасывается , куда можно позвонить ?;Сания Талапбаева;False;False;;6;2;{'date_created': '2022-01-21T17:03:01.763519+07:00', 'id': '8743075', 'logo_preview_urls': {}, 'org_name': 'Freedom Travel, агентство онлайн-бронирования билетов', 'text': 'Здравствуйте.\nК сожалению, телефонная линия действительно временно не работает. Восстановим ее работу в ближайшие дни.\nЭто вынужденная мера, так как мы направили все силы компании на обработку поступающих заявок.\n\nЧтобы оформить возврат или обмен, можно оставить заявку в личном кабинете. Все условия возвратов из-за ЧП есть по ссылке на странице https://special.aviata.kz/january-22, так же вы сможете найти ссылку на инструкцию по заявке на возврат/обмен.'};0;2gis;
26393658;2022-01-13;13:22:55;1;почему трубку не берете?;Арман Арынов;False;False;;5;1;{'date_created': '2022-01-21T16:57:42.72064+07:00', 'id': '8742996', 'logo_preview_urls': {}, 'org_name': 'Freedom Travel, агентство онлайн-бронирования билетов', 'text': 'Здравствуйте.\nВосстановим работу телефонной линии через пару дней.\nЗа период ЧП нам поступило более 160 тысяч заявок — вынуждены были все силы компании направить на их обработку.'};0;2gis;
26380797;2022-01-12;19:52:46;1;Почему не отвечаете на заявки и не отвечаете на звонок ?!;Абылайхан Шамшитов;False;False;;4;1;{'date_created': '2022-01-21T16:56:27.562673+07:00', 'id': '8742980', 'logo_preview_urls': {}, 'org_name': 'Freedom Travel, агентство онлайн-бронирования билетов', 'text': 'Здравствуйте. \nНам жаль, что заставили вас долго ждать и нервничать.\nВо время ЧП нам поступило более 160 тысяч заявок, вынуждены были все силы компании направить на их обработку. \nЕще пара дней и мы полностью восстановим скорость работы.\nЕсли у вас есть вопросы по поводу возвратов/обменов — вся информация есть на страницах по ссылке https://special.aviata.kz/january-22\nТакже по приобретенным билетам всегда можно написать в чат в личном кабинете.'};0;2gis;
26377419;2022-01-12;17:43:08;3;Оформили возврат. Но шёл практически неделю;Rakhimbek Bektayev;False;False;;5;1;{'date_created': '2022-01-21T16:33:52.936709+07:00', 'id': '8742630', 'logo_preview_urls': {}, 'org_name': 'Freedom Travel, агентство онлайн-бронирования билетов', 'text': 'Здравствуйте.\nНам жаль, что заставили вас долго ждать.\nЗа время ЧП в Казахстане нам поступило более 160 тысяч заявок. \nВынуждены были все силы направить на их обработку, но все равно потребовалось больше времени, чем обычно.\nНам нужно еще всего пару дней, чтобы полностью восстановить скорость работы.'};0;2gis;
26373916;2022-01-12;15:27:42;5;Блин ответь пожалуйста;Анара Муратбек;False;False;;2;2;{'date_created': '2022-01-21T16:38:31.352114+07:00', 'id': '8742704', 'logo_preview_urls': {}, 'org_name': 'Freedom Travel, агентство онлайн-бронирования билетов', 'text': 'Здравствуйте.\nНам жаль, что приносим вам неудобства, заверяем, что еще пара дней и мы полностью восстановим скорость работы.\nДело в том, что за период ЧП нам поступило более 160 тысяч заявок — были вынуждены все силы направить на их обработку.\n\nЕсли у вас вопросы, касающиеся уже приобретенных билетов, можете написать в чат в личном кабинете или на почту help@aviata.kz'};0;2gis;
26369226;2022-01-12;11:47:49;1;4 дн пытаюсь дозвониться не отвечаете . На сайте тишина , в личном кабинете тишина . Перенести билет не могу , отменить тоже . Пишет ошибка . Рассылку сообщений о отмене рейса не сделали . Уже кучу единиц потратил звонить в российскую авиакомпанию . Куда ещё звонить . Круглосуточный колл центр не работает . Клиентоориентированность нулевая .;Евгений Крюков;False;False;;3;2;{'date_created': '2022-01-21T16:21:38.413324+07:00', 'id': '8742380', 'logo_preview_urls': {}, 'org_name': 'Freedom Travel, агентство онлайн-бронирования билетов', 'text': 'Здравствуйте,\nЕсли ваша проблема всё еще актуальна, можно написать нам в чат в личном кабинете или на почту help@aviata.me\nНам жаль, что заставили вас нервничать.\nВо время ЧП в Казахстане нам поступило более 160 тысяч заявок — вынуждены были все силы направить на их скорейшую обработку.'};0;2gis;
26353494;2022-01-11;16:33:55;1;Делаю возврат билета а там то отказ то тишина. Почему трубки не берете. Вы должны хотя бы проконсультировать, что за отношение к клиентам?;Малина Малина;False;False;;1;1;{'date_created': '2022-01-21T16:19:42.121887+07:00', 'id': '8742326', 'logo_preview_urls': {}, 'org_name': 'Freedom Travel, агентство онлайн-бронирования билетов', 'text': 'Здравствуйте,\nнам жаль, что заставили вас нервничать.\nЗа время ЧП в Казахстане нам поступило более 160 тысяч заявок. Вынуждены были направить все силы компании на их обработку. \nПри этом все вопросы по возвратам/обменам можно задавать в чате внутри личного кабинета. \nЕсли ваша проблема всё еще актуальна, напишите, пожалуйста, нам на почту help@aviata.kz'};0;2gis;
26349097;2022-01-11;13:21:31;5;Здравствуйте. Рейсы возобновили ?;aika_tleuova@mail.ru Тлеуова;False;False;;1;1;{'date_created': '2022-01-21T16:17:18.774253+07:00', 'id': '8742271', 'logo_preview_urls': {}, 'org_name': 'Freedom Travel, агентство онлайн-бронирования билетов', 'text': 'Здравствуйте.\nВ связи с ЧП действительно были отмены рейсов в города, где закрывали аэропорты: Алматы, Актау, Актобе, Талдыкорган.\nСейчас авиасообщение со всеми городами восстановленно.'};0;2gis;
26347509;2022-01-11;11:38:07;2;"Добрый день, как до вас дозвониться? Как можно оформить возврат?? 
8 января не смогли вылететь";Baglan Khasen;False;False;;2;1;{'date_created': '2022-01-21T16:16:16.581938+07:00', 'id': '8742261', 'logo_preview_urls': {}, 'org_name': 'Freedom Travel, агентство онлайн-бронирования билетов', 'text': 'Здравствуйте,\nнам жаль, что вы столкнулись с проблемами.\nДля того, чтобы вернуть билет на отмененный во время ЧП рейс, нужно оставить заявку на «вынужденный» возврат в личном кабинете.\nПодробные условия возвратов по авиакомпаниям, а также инструкцию по личному кабинету можно найти на странице по ссылке.'};0;2gis;
26347033;2022-01-11;11:02:14;1;Не могу оформить возврат денег.;Санжар Смагулов;False;False;;1;1;{'date_created': '2022-01-21T16:13:20.17626+07:00', 'id': '8742200', 'logo_preview_urls': {}, 'org_name': 'Freedom Travel, агентство онлайн-бронирования билетов', 'text': 'Здравствуйте\nЧтобы оформить возврат, нужно оставить заявку в личном кабинете.\nВажно, билет закрепляется за номером телефона, который указан контактным при бронировании, а значит заходить в личный кабинет нужно под тем же номером, с которого бронировали.\nПодробная инструкция по правилам авиакомпаний и КТЖ, а так же инструкция по личному кабинету есть на странице по ссылке https://special.aviata.kz/january-22'};0;2gis;
26329435;2022-01-10;13:08:48;1;Верните мои 7000 тенге за 8 билетов! Почему не могу дозвониться??? Больше никогда не буду брать у вас билеты! Я должна была уехать с детьми 6-го вечером, а при возврате билетов отобрали 5500, хотя я сдала 5-го утром! Билеты на обратный путь были 10-го числа, а вы забрали 1500. За что????;Сабыржан Геслер;False;False;;2;1;{'date_created': '2022-01-21T16:10:52.638755+07:00', 'id': '8742164', 'logo_preview_urls': {}, 'org_name': 'Freedom Travel, агентство онлайн-бронирования билетов', 'text': 'Здравствуйте\n\nЧтобы мы могли разобраться в вашей ситуации и помочь, напишите, пожалуйста, номера заказов на почту help@aviata.kz и укажите суммы удержаний, с которыми вы не согласны.'};0;2gis;
26327933;2022-01-10;11:20:31;1;"Телефон не берёте хотел уточнить 14.01.22 с Алматы Медина летит или нет
Или верните деньги";Азат Арланбеков;False;False;;1;1;{'date_created': '2022-01-21T16:08:17.849453+07:00', 'id': '8742119', 'logo_preview_urls': {}, 'org_name': 'Freedom Travel, агентство онлайн-бронирования билетов', 'text': 'Здравствуйте.\n\nПо всем отмененным рейсам можно оставить заявку на «вынужденный возврат» в личном кабинете. \nЕсли рейс отменен, авиакомпании разрешают возврат или обмен без штрафов по всем видам тарифов.'};0;2gis;
26247740;2022-01-05;15:13:40;1;Почему не отвечаете на звонки . Я хочу возврат билета;Лаура Борашева;False;False;;2;1;{'date_created': '2022-01-21T16:06:22.596287+07:00', 'id': '8742077', 'logo_preview_urls': {}, 'org_name': 'Freedom Travel, агентство онлайн-бронирования билетов', 'text': 'Здравствуйте.\nВо время ЧП мы получили более 160 тысяч заявок. Вынуждены были направить все силы компании на их обработку.\nЗаявку на возврат можно оставить в любое время в личном кабинете.\nВсе правила по возвратам в ЧП и инструкция, как оставить заявку, есть по ссылке https://special.aviata.kz/january-22'};0;2gis;
25975787;2021-12-22;18:41:38;1;Зачем выкладываете номер ,если не отвечаете вообще?!! Последний раз с вами связываюсь;Z D;False;False;;0;1;{'date_created': '2021-12-23T12:33:20.084135+07:00', 'id': '8460763', 'logo_preview_urls': {}, 'org_name': 'Freedom Travel, агентство онлайн-бронирования билетов', 'text': 'Здравствуйте! Приносим извинения за предоставленные неудобства. У нас сейчас очень большая нагрузка на телефонии. Скажите, пожалуйста, с каким вопросом вы обращались и не дозвонились?'};0;2gis;
25799176;2021-12-15;10:16:37;1;Продали пустой билет из Иркутска в Санкт-Петербург . Испортили планы .;Руслан Тимирханов;False;False;;0;2;{'date_created': '2021-12-23T12:34:00.109679+07:00', 'id': '8460773', 'logo_preview_urls': {}, 'org_name': 'Freedom Travel, агентство онлайн-бронирования билетов', 'text': 'Здравствуйте! Пожалуйста, напишите номер вашего заказа, уточним как такое могло произойти'};0;2gis;
25735868;2021-12-12;18:02:05;1;Идиоты я купил билет на декабрь в ноябре 9 числа на 12 декабря каким то образом у меня билет оказался на 12 ноября и мой самолёт улетел я сейчас приехал в аэропорт мне говорят ваш самолёт улетел в ноябре пришлось опять Купить билет но не 40000 а за 80000 тысяч в личном кабинете нельзя посмотреть билет который ты купил звонил ещё в колл центр мне говорят мы сейчас вам отпарим номер Вашей брони не сказали что билет уже просрочен не покупайте у них билеты безответственная Компания лучше через Каспи намного надёжнее жду вашей обратной связи;Насиб Турсунов;False;False;;0;1;{'date_created': '2021-12-23T12:36:12.261768+07:00', 'id': '8460798', 'logo_preview_urls': {}, 'org_name': 'Freedom Travel, агентство онлайн-бронирования билетов', 'text': 'Здравствуйте! Очень жаль, что вы попали в такую ситуацию. Мы не несем ответственность за данные в билете, так как при покупке каждый пассажир самостоятельно вводит дату перелета, время, данные о своих документах. Так же после бронирования вся информация поступает на почту, чтобы перед оплатой была возможность перепроверить всю введенную информацию.'};0;2gis;
25581170;2021-12-06;10:43:17;5;Лучшее агентство по продаже авиабилетов;Obvs;False;False;;0;1;{'date_created': '2021-12-07T13:35:37.743556+07:00', 'id': '8276937', 'logo_preview_urls': {}, 'org_name': 'Freedom Travel, агентство онлайн-бронирования билетов', 'text': 'Здравствуйте! Рады, что Вам нравится наш сервис. Спасибо за отзыв!'};0;2gis;
25169111;2021-11-18;18:34:40;1;Не советую покупать авиабилеты на Авиата. Колл-центр вовсе не отвечает. Вчера провисел минут 10 на линии. Сегодня также не дозвонился. Что есть колл-центр, что его нет - одно и то же. Даже в государственной КТЖ сервис лучше.;Aqylbek Muratbai;False;False;;1;1;{'date_created': '2021-12-23T12:38:55.947273+07:00', 'id': '8460833', 'logo_preview_urls': {}, 'org_name': 'Freedom Travel, агентство онлайн-бронирования билетов', 'text': 'Здравствуйте! Приносим извинения за доставленные неудобства, у нас очень большая нагрузка на телефонии. Жаль, что у вас сложилось такое впечатление о нас. Если у вас возникают вопросы, вы так же можете отправлять их нам на почту help@aviata.kz.'};0;2gis;
24873748;2021-11-05;12:00:03;5;Здравствуйте, я забронировала 2 жд билета,пр регистраций показывала сумму 8600 а при оплате она стала меньше ,тоесть 6800.почему?;Шерхан Ахметов;False;False;;0;1;{'date_created': '2021-11-05T13:03:10.377354+07:00', 'id': '7918403', 'logo_preview_urls': {}, 'org_name': 'Freedom Travel, агентство онлайн-бронирования билетов', 'text': 'Здравствуйте! Благодарим за обращение💚 Просим указать, код брони или номер билета , к которому относится данное обращение в личном чате.'};0;2gis;
24076507;2021-10-01;14:47:23;1;"Добрый день! Не советую покупать билеты на Aviata.Kz. Бывает человеческий фактор, если допустите хоть в одной букве ошибку(ФИО) за исправления отдадите не малые деньги для исправления одной буквы. 

P.s. : лучше покупать билеты напрямую на сайте авиакомпании. Корректировка ошибок бесплатно если с сайта авиакомпании покупать.";Yernur Zhexenbayev;False;False;;1;1;{'date_created': '2021-10-07T12:20:47.134858+07:00', 'id': '7604711', 'logo_preview_urls': {}, 'org_name': 'Freedom Travel, агентство онлайн-бронирования билетов', 'text': 'Здравствуйте! Нам очень жаль, что Вы столкнулись с такой ситуацией. Это правила авиакомпании, к сожалению, мы никак не можем на это повлиять💚'};0;2gis;
23674081;2021-09-13;16:18:57;5;Не знаю, почему отзывы такие, но мне все понравилось. За возврат билета деньги вернули сразу, через день практический или меньше. Так же, хочу отметить работу операторов, очень милые и квалифицированные ребята. Спасибо большое за консультацию! Никаких претензии не имею и надеюсь никогда не буду😊;Akerke Batybay;False;False;;0;1;{'date_created': '2021-09-15T16:44:21.779381+07:00', 'id': '7381733', 'logo_preview_urls': {}, 'org_name': 'Freedom Travel, агентство онлайн-бронирования билетов', 'text': 'Акерке, здравствуйте! Спасибо за теплые слова, рады, что вы довольны нашим сервисом)'};0;2gis;
22203510;2021-07-09;10:55:43;1;"«Помните как это было до авиаты?». 
Я прекрасно помню эти светлые, безмятежные времена, когда не было этой бредовой, назойливой рекламы в Ютюбе";GETBIG GETRICH;False;False;;1;0;;0;2gis;
21845964;2021-06-22;20:19:14;1;Купила дополнительный багаж через эту компанию и по итогу что ? Они не внесли в систему багаж . Я оплачивала опять таки багаж сама при регистрации . Чем покупать через эту компанию лучше сразу обратиться напрямую к самой авиалинии;Kuda Almaty;False;False;;0;0;;0;2gis;
21830866;2021-06-22;04:02:30;1;Конченная компания. Корректировку в билетах делают сутки, кормят завтраками. Никто и никогда не покупайте через них билеты!;elwynnforest;False;False;;3;0;;0;2gis;
20503200;2021-04-18;15:30:16;5;Через эту компанию брали билеты на поезд, но решили вернуть. В Жд сдали билет, но не вернули деньги, прошёл месяц, связались с Авиата, за часа полтора вернули деньги. В общем, очень доволен этой компанией! Оперативно сработали!;Nurtas Mukashev;False;False;;0;0;;0;2gis;
19968913;2021-03-23;14:24:03;1;Сервис 0!!!!!!!!!!!!!!!!!!;Y Y;False;False;;1;0;;0;2gis;
19843344;2021-03-17;01:41:47;1;Будьте осторожнее с этой компанией, брал у них билет, после поменялись планы, обратился решите сказал вопрос возврата, сказали что езжай на вокзал и оформляй возрат, тогда вопрос к компании :Господа тогда зачем продаёте билеты, если не можете за них нести ответственность? Скажите это не в нашей компетенции?Ответ простой:Раз Вы организовали этот сервис, значит качаете бабло, так? Точно так, ни вопрос качай, но и сервис делай честный, как? Нанимай водителя, заключил договор с КТЖ, не возратили билет? Тогда Пускай наличными или на карту платит Твоя компания, тем кто не смог сдать билет!! Тогда бизнес будет честный, не получается? Тогда не делай бизнес, раз не можешь ответить!!;Артур Володин;False;False;;6;1;;0;2gis;
19833848;2021-03-16;17:38:39;5;Асылбек из службы поддержки лучший! Все сделал за меня, спасибо большое ☺️;Zhazi Kantarbayeva;False;False;;0;0;;0;2gis;
19691967;2021-03-09;16:09:32;1;"Просто ужасный сервис. Покупала билет по одной цене, оплатила все и жду. А билета нет. Звоню им, а мне говорят, что цены уже изменились и мне еще нужно доплатить!!! Нормально? То есть, я оплатила, а они мне не дали билет! 
Никому не советую!";Айым Бахытбекова;False;False;;2;0;;0;2gis;
