id;дата;время;рейтинг;текст;автор;is_verified;is_hidden;hiding_type;likes_count;comments_count;official_answer;фото_count;provider;url
234350354;2026-04-07;02:38:19;5;Открыл расчётный счёт для фирмы у Фридома, подключил эквайринг с хорошим тарифом. У банка гибкие условия для малого бизнеса.;Бақберген Д;False;False;;0;1;{'date_created': '2026-04-07T05:40:05.978841+07:00', 'id': '64025428', 'logo_preview_urls': {}, 'org_name': 'Freedom Bank, отделение по обслуживанию VIP-клиентов', 'text': 'Доброй ночи! Благодарим вас за отзыв 💚\nРады, что вы выбрали нас для обслуживания вашего бизнеса и оценили условия по расчётному счёту и эквайрингу 🙌\nЖелаем вашему бизнесу роста и процветания! Всегда готовы поддержать и помочь 😊'};0;2gis;
233657961;2026-04-03;21:08:52;5;Выражаю благодарность менеджеру, извините забыл имя, за профессиональную помощь. Обслуживание прошло оперативно и оставило самые приятные впечатления;Мурат Мадиев;False;False;;0;1;{'date_created': '2026-04-04T18:44:59.455937+07:00', 'id': '63916387', 'logo_preview_urls': {}, 'org_name': 'Freedom Bank, отделение по обслуживанию VIP-клиентов', 'text': 'Добрый день! Спасибо за ваши ценные комментарии.'};0;2gis;
231751941;2026-03-26;14:38:48;5;Жақсы тусіндіреді;Ахат Қорынбай;False;False;;0;1;{'date_created': '2026-03-26T22:16:37.136394+07:00', 'id': '63468869', 'logo_preview_urls': {}, 'org_name': 'Freedom Bank, отделение по обслуживанию VIP-клиентов', 'text': '💚💚💚'};0;2gis;
229080822;2026-03-14;20:13:22;1;Ноль просто контора . Никого ответа от менеджера или от банка.;Bolat Amreyev;False;False;unrated_manual;0;0;;1;2gis;
228896320;2026-03-13;21:53:57;1;банк расии для серых тем и обхода санкции , ребрендинг не изменило ваше отношения к людям , не пользуйтесь услугами этого банка .;Sancho Stopor;False;False;;0;0;;0;2gis;
228881376;2026-03-13;20:45:20;5;хотела машину давно уже, планировала накопить, но из-за непредвиденных трат решила взять кредит на авто, выбрала Фридом банк из-за удобства оформления и коротких сроков рассмотрения. Ребя не подвели, все быстро и юез проблем оформила. Спасибо;Әди Ержанұлы;False;False;;0;1;{'date_created': '2026-03-13T23:15:07.752198+07:00', 'id': '62774939', 'logo_preview_urls': {}, 'org_name': 'Freedom Bank, отделение по обслуживанию VIP-клиентов', 'text': 'Добрый вечер! Спасибо за доверие и выбор нашего Банка! Рады, что оформление прошло быстро и удобно для вас 🚗💚'};0;2gis;
228693228;2026-03-12;21:14:44;5;Сотрудники, которые консультируют по кредиту молодцы, рассказали все в деталях Спасибо, оформила выгодный кредит для ИП. Рассмотрели тоже за один день, как и обещали. Спасибо;Рамина Махмудова;False;False;;0;1;{'date_created': '2026-03-12T23:23:12.054854+07:00', 'id': '62723313', 'logo_preview_urls': {}, 'org_name': 'Freedom Bank, отделение по обслуживанию VIP-клиентов', 'text': 'Добрый вечер!\nБлагодарим за ваш отзыв! Рады, что консультация была подробной, а оформление кредита прошло быстро и удобно. Ваши слова вдохновляют нашу команду продолжать работать для клиентов с вниманием и профессионализмом.'};0;2gis;
218826029;2026-02-12;12:27:05;5;Отличное приватное отделение. Хочу поблагодарить менеджера Ускенову Алию за оперативную помощь, чёткое разъяснение. Именно такая работа коллектива (персональных менеджеров, кассира (также хочу отметить ее работу), способствует долгосрочному сотрудничеству с банком.;Don4a !;False;False;;0;1;{'date_created': '2026-02-12T20:27:55.13693+07:00', 'id': '61269246', 'logo_preview_urls': {}, 'org_name': 'Freedom Bank, отделение по обслуживанию VIP-клиентов', 'text': 'Добрый вечер! Благодарим вас за такой развёрнутый и тёплый отзыв 😊 Нам очень приятно, что вы отметили профессионализм и командную работу сотрудников. Спасибо за доверие и выбор нашего банка!'};0;2gis;
218169306;2026-02-10;13:59:53;5;Отделение камерное, но очень удобное! Менеджер Алия все очень доступно объяснила , помогла разобраться в тонкостях проведения платежей в Европу, оперативного оформления банковских кард! Самое удобное, что попасть в него можно прямо в отеле, что называется в тапочках)) в общем, для постояльцев отеля - это очень комфортно) Буду тут обслуживаться впредь!);Николай Попов;False;False;;0;1;{'date_created': '2026-02-10T15:33:30.630389+07:00', 'id': '61141277', 'logo_preview_urls': {}, 'org_name': 'Freedom Bank, отделение по обслуживанию VIP-клиентов', 'text': 'Добрый день, благодарим, что уделили время и написали отзыв 😌💚'};0;2gis;
215734905;2026-01-30;23:26:59;5;Здраствуйте,у меня есть Фредом супер ап для моей Білім класс,онлайн есть карта,я чтобы платить в магазинах нужно пойти и открыть? Нельзя до дома?;Salta .;False;False;;0;1;{'date_created': '2026-01-31T13:03:31.004405+07:00', 'id': '60606952', 'logo_preview_urls': {}, 'org_name': 'Freedom Bank, отделение по обслуживанию VIP-клиентов', 'text': 'Добрый день! Вы можете привязать карту к Apple Pay, Google Pay или Samsung Pay для бесконтактной оплаты и использовать цифровую карту для покупок через терминалы. Также родитель может заказать пластиковую карту для ребенка прямо в своем мобильном приложении Freedom SuperApp.'};0;2gis;
215650861;2026-01-30;17:23:01;5;"Очень оперативно и профессионально сработали сотрудники данного отделения. На необходимые вопросы получил максимально развёрнутые ответы. Без очередей, ожиданий и с максимальной лояльностью к клиенту.
Благодарен, рекомендую🙏";Эдгар Уразметов;False;False;;0;1;{'date_created': '2026-01-30T17:55:19.670636+07:00', 'id': '60580205', 'logo_preview_urls': {}, 'org_name': 'Freedom Bank, отделение по обслуживанию VIP-клиентов', 'text': 'Добрый день! \nБлагодарим вас за отзыв. \nРады, что обслуживание прошло оперативно и профессионально, и что вы остались довольны качеством консультации. \nСпасибо, что вы с нами!💚'};0;2gis;
215440702;2026-01-29;17:28:28;1;"Некомпетентные и грубые менеджеры. Зашла открыть карту и получить выписку, так меня футболили и говорили «ждите 20 минут», потом вообще сказали «у нас только по записи, идите в зале сидите, пока не позовем, у нас вип-отделение». 

Нигде не указано, что только по записи - это первое, можно было сказать сразу, а не заставлять меня ждать почти 40 минут, а после еще и грубить мне, потому что у меня на лбу не написано, что у меня есть деньги открыть вип-карту - это второе.

Ни проконсультировали, нагрубили и не решили мой запрос.";Dilya Abd;False;False;;1;1;{'date_created': '2026-01-29T21:36:33.761664+07:00', 'id': '60539248', 'logo_preview_urls': {}, 'org_name': 'Freedom Bank, отделение по обслуживанию VIP-клиентов', 'text': 'Добрый вечер! Нам искренне жаль, что вы столкнулись с таким отношением и получили негативный опыт при посещении отделения. Мы уже передали ваш отзыв руководству для детального анализа и принятия необходимых мер. Благодарим вас за обратную связь - она помогает нам улучшать качество обслуживания.'};0;2gis;
213785953;2026-01-22;18:36:45;5;Очень грамотное обслуживание. Алия профессионал своего дела. Все четко и быстро. Спасибо.;Marat Bakiyev;False;False;;0;1;{'date_created': '2026-01-23T15:40:14.335343+07:00', 'id': '60212023', 'logo_preview_urls': {}, 'org_name': 'Freedom Bank, отделение по обслуживанию VIP-клиентов', 'text': 'Спасибо, что выбрали нас 🙏 Рады стараться.💚'};0;2gis;
212539411;2026-01-16;23:05:54;3;Максимально не удобное расположение;StK K;False;False;;1;1;{'date_created': '2026-01-18T03:19:31.51949+07:00', 'id': '59922012', 'logo_preview_urls': {}, 'org_name': 'Freedom Bank, отделение по обслуживанию VIP-клиентов', 'text': 'Доброй ночи! Спасибо, что поделились своим мнением. Нам жаль, что расположение оказалось для вас неудобным. Мы обязательно учтём ваш отзыв при дальнейшем расширении и будем рады видеть вас снова 🙌🏻'};0;2gis;
212060349;2026-01-14;14:45:46;5;Очень удобное отделение, время работы отличное, компетентные менеджера 👍🏻;Джалиль Гареев;False;False;;0;1;{'date_created': '2026-01-14T15:13:45.816225+07:00', 'id': '59743384', 'logo_preview_urls': {}, 'org_name': 'Freedom Bank, отделение по обслуживанию VIP-клиентов', 'text': 'Добрый день!\nСпасибо за ваш отзыв! Рады, что все вопросы удалось решить оперативно. Ваши слова лучшая мотивация для нашей команды.'};0;2gis;
211917854;2026-01-13;18:32:33;5;Қызмет көрсету жоғары деңгейде👍;Apple User;False;False;;0;1;{'date_created': '2026-01-13T23:35:30.872965+07:00', 'id': '59716377', 'logo_preview_urls': {}, 'org_name': 'Freedom Bank, отделение по обслуживанию VIP-клиентов', 'text': 'Қайырлы кеш! Пікіріңізге көп рақмет! Қызметіміз сізге ұнағанына қуаныштымыз 💚'};0;2gis;
211297874;2026-01-10;18:25:46;5;"Девушки работают оперативно и четко.
Никаких нареканий к работе нет.
Молодцы👍🏻";Alisher ..;False;False;;0;1;{'date_created': '2026-01-11T02:24:04.236272+07:00', 'id': '59548492', 'logo_preview_urls': {}, 'org_name': 'Freedom Bank, отделение по обслуживанию VIP-клиентов', 'text': 'Alisher, добрый вечер. Спасибо вам большое, что оценили 🤗 Будем рады вам всегда.'};0;2gis;
210859895;2026-01-08;11:25:52;5;Керемет;Turmakhan Kairat;False;False;;0;1;{'date_created': '2026-01-09T02:56:29.581392+07:00', 'id': '59474991', 'logo_preview_urls': {}, 'org_name': 'Freedom Bank, отделение по обслуживанию VIP-клиентов', 'text': 'Қайырлы түн! Қызметіміз сізге ұнағанына қуаныштымыз 😊'};0;2gis;
209056100;2025-12-29;00:20:17;5;Очень приятная девушка сегодня нас обслуживала. Спасибо,что работаете в выходные!);Asel Abdi;False;False;;1;1;{'date_created': '2025-12-29T13:59:12.016209+07:00', 'id': '59111750', 'logo_preview_urls': {}, 'org_name': 'Freedom Bank, отделение по обслуживанию VIP-клиентов', 'text': 'Asel, добрый день. Большое спасибо за отзыв 🔥 Ждём вас снова. Поздравляем с наступающим Новым годом 💚'};0;2gis;
208959076;2025-12-28;16:11:54;5;Самый лучший банк , как всегда быстро оперативно 💖 работает супер график;Rita Dauyenova;False;False;;2;1;{'date_created': '2025-12-29T13:56:36.857632+07:00', 'id': '59111509', 'logo_preview_urls': {}, 'org_name': 'Freedom Bank, отделение по обслуживанию VIP-клиентов', 'text': 'Добрый день! Благодарим вас за тёплые слова 🤗 Будем рады видеть вас снова! Поздравляем с наступающим Новым годом 💚'};1;2gis;
207378714;2025-12-23;12:38:27;5;VIP-отделение банка оставило очень приятное впечатление: высокий уровень сервиса, внимательное отношение и оперативное решение всех вопросов. Комфортная атмосфера и профессиональная команда — всё на уровне.;Lucky Luchiano;False;False;;1;1;{'date_created': '2025-12-23T14:18:42.515177+07:00', 'id': '58820997', 'logo_preview_urls': {}, 'org_name': 'Freedom Bank, отделение по обслуживанию VIP-клиентов', 'text': 'Добрый день! Спасибо за ваш отзыв. Нам очень приятно, что посещение отделения оставило у вас положительные впечатления 💚'};0;2gis;
206079657;2025-12-16;14:18:26;1;"Надеюсь, этот отзыв увидит менеджер/руководитель. 
Отделение для вип-клиентов подразумевает, первую очередь, КОМПЕТЕНТНОГО сотрудника , а также сервис .
Люди пришли уже по умолчанию с большими деньгами/ депозитами, на вопрос чем отличаются вип-карты, сотрудник говорит , что ДИЗАЙНОМ 🤣🤓 
Это последнее, что интересует. Никаких таблиц с цифрами, чтоб наглядно все рассказать, никакой даже на словах информации. Развернулись и ушли . 

Русский язык ломаный, я боюсь представить, какой там английский . 
Неприятное впечатление от «вип-сервиса».";Valentina P;False;False;;3;1;{'date_created': '2025-12-17T01:15:17.566714+07:00', 'id': '58508100', 'logo_preview_urls': {}, 'org_name': 'Freedom Bank, отделение по обслуживанию VIP-клиентов', 'text': 'Здравствуйте!\nНам очень жаль, что вам пришлось столкнуться с неудобствами. Пожалуйста, напишите нам в Direct Instagram @bankffin.kz - мы всё подробно проверим и постараемся помочь вам в кратчайшие сроки.'};0;2gis;
206064760;2025-12-16;12:38:41;1;За досрочное погашение берут комиссию больше 20% 🥶;Alfiya Nwuke;False;False;;2;1;{'date_created': '2025-12-16T13:02:49.856886+07:00', 'id': '58470013', 'logo_preview_urls': {}, 'org_name': 'Freedom Bank, отделение по обслуживанию VIP-клиентов', 'text': 'Добрый день! Чтобы мы могли детально проверить вашу ситуацию, пожалуйста, свяжитесь с нами через Instagram Direct @bankffin.kz, WhatsApp +7 776 1 595 595, позвоните на горячую линию 595. Или оставьте свои контактные данные - мы свяжемся с вами и поможем разобраться.'};0;2gis;
204067321;2025-12-05;13:36:19;5;Отличное обслуживание, вежливый персонал и быстрое решение всех вопросов. Приятно, когда в отделении реально заботятся о клиентах;Максим Попов;False;False;;1;1;{'date_created': '2025-12-05T21:58:54.069746+07:00', 'id': '57970077', 'logo_preview_urls': {}, 'org_name': 'Freedom Bank, отделение по обслуживанию VIP-клиентов', 'text': 'Добрый вечер. Благодарим вас за ваш отзыв и оценку. Очень приятно!'};0;2gis;
196712413;2025-10-31;13:42:30;5;"Отзыв о работе сотрудника Freedom Bank — Махсан Анель 🌟

Хочу выразить искреннюю благодарность Махсан Анель, старшему кассиру Freedom Bank, за её высокий профессионализм и внимательное отношение к клиентам.
Анель всегда встречает с улыбкой, быстро и чётко решает любые вопросы, объясняет все детали доступно и доброжелательно.
Работает с исключительной ответственностью и заботой о клиентах — приятно, когда чувствуешь реальную поддержку и участие!

Спасибо Анель за отличное обслуживание и позитивное настроение, с которым хочется возвращаться снова 💚";Indira Azangulova;False;False;;2;1;{'date_created': '2025-10-31T19:42:01.650947+07:00', 'id': '56085806', 'logo_preview_urls': {}, 'org_name': 'Freedom Bank, отделение по обслуживанию VIP-клиентов', 'text': 'Добрый вечер! Благодарим вас за отзыв и такую искреннюю оценку! Очень рады, что обслуживание оставило у вас положительные впечатления. Нам приятно знать, что вы отметили внимательность и профессионализм нашего специалиста. 💚'};0;2gis;
196284040;2025-10-29;14:34:44;1;"Не указано, на каком этаже находится офис и что обслуживание осуществляется исключительно для руководителей.
Из-за отсутствия этой информации пришлось ехать впустую, что привело к напрасной потере времени и вызывает обоснованные претензии к организации работы.";Рауа Садвакасова;False;False;;16;0;;0;2gis;
194426326;2025-10-21;17:06:09;5;Әлия мың алғыс Сізге! Барлығын түбегейлі түсіндірдіңіз. Күтіп алу, шығығарып салу керемет! Жұмыстарыңызға табыс, отбасыңызға береке тілеймін!;Сапар Калыбек;False;False;;0;1;{'date_created': '2025-10-22T06:47:19.260082+07:00', 'id': '55534937', 'logo_preview_urls': {}, 'org_name': 'Freedom Bank, отделение по обслуживанию VIP-клиентов', 'text': 'Қайырлы таң! Сіздің тәжірибеңіздің оң болғанына қуаныштымыз. Біздің қызметке берген жоғары бағаңыз бен алғысыңыз үшін рақмет.'};0;2gis;
194193905;2025-10-20;16:54:39;1;Выделила время открыть карту банка Freedom bank в Есентай Молле. По этой локации есть филиал банка и отдельно от него расположенные банкомат и картомат. Картомат не работает в обоих местах - и в отделении банка и в Молле. Менеджер банка имеет худшую проф подготовку, забывает заданные вопросы через 2 секунды, никакого диалога с ней не получилось. Call центр не имеет опции работы по картам . Он полностью автоматический , без связи с оператором. Худший банк. Мне жаль мое потерянное время;Olga Olga;False;False;;2;1;{'date_created': '2025-10-20T18:38:03.585035+07:00', 'id': '55443065', 'logo_preview_urls': {}, 'org_name': 'Freedom Bank, отделение по обслуживанию VIP-клиентов', 'text': 'Добрый день! Нам важно разобраться и помочь вам. Пожалуйста, свяжитесь с нами через Direct Instagram @bankffin.kz, WhatsApp +7 776 1 595 595 или короткий номер 595.'};0;2gis;
193766167;2025-10-18;15:45:34;1;Написано до 22:00 в пятницу в 20:00 было закрыто;Сая Кульбаева;False;False;;0;0;;0;2gis;
